ID,BANK,IFSC_CODE,MICR_CODE,BRANCH_NAME,ADDRESS,CONTACT,CITY,DISTRICT,STATE
ALLA0212543,Allahabad Bank,ALLA0212543,APPLIED,VASAI,"HOMAGE BHAVAN,RICHMOND TOWN, BABHOLA NAKA, VASAI","SH UTTAM KHOT, SH RAKESH KUMAR, 0250-2384777",MUMBAI,GREATER BOMBAY,MAHARASHTRA
ALLA0212544,Allahabad Bank,ALLA0212544,APPLIED,JIYAKHARA,"PO- MANIGRAHI,BLOCK - SARWANA DIST - DEOGHAR","H H KULLU, 09431565676",DEOGHAR,DEOGHAR,JHARKHAND
ALLA0212545,Allahabad Bank,ALLA0212545,APPLIED,"SKMU BRANCH ,DUMKA","PO-DUMKA, DIST - DUMKA","S N SAHAY, 09334041188",DUMKA,DUMKA,JHARKHAND
ALLA0212546,Allahabad Bank,ALLA0212546,APPLIED FOR,GADAIPUR,"A-7, NIRWANA APPTT,GROUND FLOOR, DELHI-30","MR  B D MAURYA,  9810520981, MR  V K GUPTA, 9899799710",DELHI,DELHI,DELHI
ALLA0212547,Allahabad Bank,ALLA0212547,560010018,RAJANAGAR BANGALORE," 136, DR. RAJKUMAR ROAD,1ST BLOCK,RAJAJINAGAR, BANGALORE-560010","MR S RAMCHANDRA, MRS KAVITA BALSE, 9611668040,  080-23326060  ",BANGALORE,BANGALORE URBAN,KARNATAKA
ALLA0212548,Allahabad Bank,ALLA0212548,587010102,BAGALKOT,"B.V.V.SANGHA PREMISES, OPP. CIT BUS STAND, BAGALKOT - 587101","MR H G KULKARNI, 9986043220, MR ANIL KUMAR, 08354-220084",BAGALKOT,BAGALKOTE,KARNATAKA
ALLA0212549,Allahabad Bank,ALLA0212549,110010090,KHAIRA,"ALLAHABAD BANK,KHAIRA VILLAGE NEAR BUS STOP , NEW DELHI - 110043","SH. PRABHAT KUMAR, 011-28011526 , 989166498",KHAIRA,MATHURA,UTTAR PRADESH
ALLA0212550,Allahabad Bank,ALLA0212550,411010007,HINJEWADI,"ALLAHABAD BANK SHOP NO 3 &4 ,KHANEKAR COMPLEX,SHIVAJI CHOWK,HINJEWADI,TAL MULSHI DIST-PUNE 411057","ARUN DESHPANDE, 9273557387, NISHA PRAKASH, 9326506863",HINJAWADI,PUNE,MAHARASHTRA
ALLA0212551,Allahabad Bank,ALLA0212551,APPLIED FOR,KIRI AFGANA,"CHADHA SUGAR & INDUSTRIES LTD., DHAN LAXMI ESTATE, KIRI AFGNA, TEHSIL BATALA, DISTRICT GURDASPUR (PUNJAB), PIN 143 527","SHRI R C MAHAJAN, 01872 209611, SHRI SANDEEP UPPAL, 01872-209611",KALA AFGHANA,GURDASPUR,PUNJAB
ALLA0212552,Allahabad Bank,ALLA0212552,APPLIED FOR,MACHIWARA,"OPPOSITE HAR MILAP FILLING STATION, SAMRALA ROAD, MACHIWARA, DISTRICT LUDHIANA (PUNJAB), PIN 141 115","SHRI SUKHPAL SINGH, 01628-251325, SHRI BRIJ MOHAN, 01628-251325",MACHHIWARA,LUDHIANA,PUNJAB
ALLA0212553,Allahabad Bank,ALLA0212553,APPLIED FOR,PATRAN,"OPPOSITE C.I. STAFF QUARTERS, NEAR MANDI OFFICE, NARWANA ROAD, PATRAN, DISTRICT PATIALA (PUNJAB), PIN 147 105","SHRI HARBANS LAL, 09417491565, SHRI TAQDEER BERWAL, 09417491565",PATRAN,PATIALA,PUNJAB
ALLA0212554,Allahabad Bank,ALLA0212554,110010091,DAULTABAD,"VILLAGE DAUALATABAD, NEAR GOVT SENIOR SECONDARY SCHOOL.-GURGAON","R.K GUPTA, SATISH AHLUWALIA- 01242468120",DAULATABAD,FARIDABAD,HARYANA
ALLA0212555,Allahabad Bank,ALLA0212555,110010092,CHHAINSA,"GOLD FIELD EDUCATIONAL CAMPUS, VILLAGE CHHAINSA, TEHSIL BALLADGARH, DIST. FARIDABAD, HARYANA.","DEEVENDRA SINGH, CHANDER BHAN, 09466967521",CHHAINSA,FARIDABAD,HARYANA
ALLA0212556,Allahabad Bank,ALLA0212556,APPLIED FOR,ISWARIPUR,"VILL. ISWARIPUR, PO SURYAPUR, PS KHARDAH, DIST. 24 PARGANAS (NORTH), WEST BENGAL","JOTIRMOY BISWAS, 9735972112",ISHWARIGACHA,NORTH 24 PARGANAS,WEST BENGAL
ALLA0212557,Allahabad Bank,ALLA0212557,700010195,SASHAN,"VILL-SHASAN, PO: BARUIPUR, NEAR SHASAN RAILWAY STATION, DIST-SOUTH 24 PARGANAS, WEST BENGAL PIN- 700144","VIKAS KUMAR, 9883356688, RAJAT SUBHRA BISWAS, 9433043967",BARUIPUR,SOUTH 24 PARGANAS,WEST BENGAL
ALLA0212558,Allahabad Bank,ALLA0212558,APPLIED FOR,GHARONDA," ALLAHABD BANK , SHOP NO 179, NEW GRAIN MARKET, GHARONDA, DISTT KARNAL, HARYANA-132114","SHRI S C KAJAL, KULDEEP,  94162-74994, 9468445432",GHARAUNDA,KARNAL,HARYANA
ALLA0212559,Allahabad Bank,ALLA0212559,APPLIED FOR,MANDI,"ALLAHABAD BANK , H.NO 114/12, RAMNAGAR MANDI, HIMACHAL PRADESH -175001","RAMANAND, NIRBHAY SINGH, 9418621300, 9816064434",MANDI,MANDI,HIMACHAL PRADESH
ALLA0212560,Allahabad Bank,ALLA0212560,854010711,BISHUNPUR,"VILL-BISHANPUR MAWAIYA, PO-BISHUNPUR, BLOCK KORHA, DIST-KATIHAR, STATE-BIHAR, PIN-854115","SHRI PRADEEP KUMAR, SHRI ANURAG KUMAR, 9693523947, 9334134862",KATIHAR,KATIHAR,BIHAR
ALLA0212561,Allahabad Bank,ALLA0212561,110010093,JAGATPUR BRANCH,"ALLAHABAD BANK,REGAL PALACE,GALI NO. 5, MAIN ROAD,JAGATPUR,P.O-BURARI,DELHI","MR.T.C.GUPTA, MR.VIRENDER, 9810826888, 9891835390",BURARI,DELHI,DELHI
ALLA0212562,Allahabad Bank,ALLA0212562,APPLIED FOR,PATHANANTHITTA,"KUNNITHOTTAHIL TOWER, RING ROAD, ST PETERS JUNCTION, PATHANANTHITTA,KERELA-689648","SASI KUMAR, 9446422898, SREELAL S, 08089653616",PATHANAMTHITTA,PATHANAMTHITTA,KERALA
ALLA0212563,Allahabad Bank,ALLA0212563,575010003,KARKALA BRANCH,"KARKALA BRANCH, ALLAHABAD BANK,DARBAR BUILDING,SALMAR ROAD, KARKALA, KARNATAKA-574104","USHA NAYAK, 09343524558, K.NAGRAJ, 09886687956",KARKALA,UDIPI,KARNATAKA
ALLA0212564,Allahabad Bank,ALLA0212564,APPLIED FOR,BAHAL,"ALLAHABAD BANK, C/O BALARAM HANUMANDAS CHARITABLE TRUST, MANGAL MARKET BUS STAND, BAHAL, DISTT. BHIWANI, HARYANA- 127028","MR. J.K. SILLE, MR.NEM PRAKASH, 9813245919, 9417627726",BAHL,BHIWANI,HARYANA
ALLA0212565,Allahabad Bank,ALLA0212565,110010094,MATIYALA,"PLOT NO.1, KHASRA NO. 31/20,MATIYALA, DELHI PIN-110059","TEJ SINGH, 9899697606",DELHI,DELHI,DELHI
ALLA0212566,Allahabad Bank,ALLA0212566,781010007,G S ROAD GUWAHATI,"OPP. RAJIV BHAVAN, CHRISTINA BASTI, G.S. ROAD, GUWAHATI, ASSAM, PIN: 781005","JITEN CH. DAS, 9435476442, AJAY AKELA, 9435861910",GUWAHATI,KAMRUP,ASSAM
ALLA0212567,Allahabad Bank,ALLA0212567,400010038,DOMBIVALI,"MAHATMA PHULE ROAD, PRIYADARSHANI APARTMENT, DOMBIVALI (WEST) - 421202","RAJENDRA L GODIA, 9890279199",DOMBIVLI,THANE,MAHARASHTRA
ALLA0212568,Allahabad Bank,ALLA0212568,176010202,PALAMPUR,"ALLAHABAD BANK, SCO NO. 50-51, GRAND PLAZA, NEAR HOTEL YAMINI, PALAMPUR, DISTT-KANGRA(H.P.), PIN : 176061  ","SANDEEP BHARDWAJ, DEBANSHU SHARMA, 8894067673, 9736694006",PALAMPUR,KANGRA,HIMACHAL PRADESH
ALLA0212569,Allahabad Bank,ALLA0212569,851010503,BHARATKHAND,"VILL & PO-BHARATKHAND, VIA-NARAYANPUR, DIST- KHAGARIA, STATE-BIHAR, PIN-853203","SHRI ANAND KRISHNA, SHRI S.C. PODDAR, 9608660082, 9386083100",KHAGARIA,KHAGARIA,BIHAR
ALLA0212570,Allahabad Bank,ALLA0212570,160010202,MANIMAJRA,"SCF-293, MOTOR MARKET, MANIMAJRA, CHANDIGARH, PIN-160101","ANIL KUMAR, 9041791503",MANI MAJRA,CHANDIGARH,CHANDIGARH
ALLA0212571,Allahabad Bank,ALLA0212571,110010095,SOHNA,"BYE PASS, MAIN SOHNA ROAD, SOHNA - 122 103. DIST GURGAON","MR ROHTASH SIINGH, 9899567717, MR MANGLA",SOHNA,GURGAON,HARYANA
ALLA0212572,Allahabad Bank,ALLA0212572,110010096,GURGAON SECT 15,"391/1 ACHARYAPURI, GURGAON - 122001","MR K N GROVER 9968306314, MS PREETI JAIN 9811213592",GURGAON,GURGAON,HARYANA
ALLA0212573,Allahabad Bank,ALLA0212573,132010103,NILOKHERI BRANCH,"SHOP NO.22, NEAR GRAIN MARKET, NILOKHERI, DISTT KARNAL, HARYNA PIN-132117","HARISH WADHAWAN, NEHA, 9996023442",NILOKHERI,KARNAL,HARYANA
ALLA0212574,Allahabad Bank,ALLA0212574,231010175,ANPARA,"ALLAHABAD BANK, BEENA ROAD, ANPARA, DISTRICT- SONEBHADRA (UP)- 231225","MR. NEERAJ KUMAR MISHRA, MR. ATUL KUMAR GAURAV, 8874520678, 7376599858",ANAPARA,SONBHADRA,UTTAR PRADESH
ALLA0212575,Allahabad Bank,ALLA0212575,160010013,"SECTOR-40 D, CHANDIGARH","SCO NO. 327, SECTOR-40 D, CHANDIGARH,PIN-160036","V.S.AHLUWALIA, DESH DEEPAK, 9316032504",CHANDIGARH,CHANDIGARH,CHANDIGARH
ALLA0212576,Allahabad Bank,ALLA0212576,400010039,BANDRA WEST,"SHOP NO.1, CHAPPEL AVENUE PREMISES, CO. SO. LTD. CHAPPEL ROAD, BANDRA(W)-400050","SUNIL MANI,SUNIL JOJO, 8108751471",MUMBAI,GREATER BOMBAY,MAHARASHTRA
ALLA0212577,Allahabad Bank,ALLA0212577,842010505,DHARAMPUR,"VILL & PO-DHARAMPUR, VIA- RAMPUR HARI, DISTT- MUZAFFARPUR, PIN- 843117","SURESH CHANDRA MISHRA, 919801889175, PRABHAT MISHRA, 919973132409",MUZAFFARPUR,MUZAFFARPUR,BIHAR
ALLA0212578,Allahabad Bank,ALLA0212578,842010506,MADHAUL,"VILL-MADHAUL, PO-  SUSTA MADHOPUR, DISTT- MUZAFFARPUR, PIN - 842002","DINESH KUMAR THAKUR, 9431092127, SUSHIAL KUMAR, 9308618941",MADHOPUR SUSTA,MUZAFFARPUR,BIHAR
ALLA0212579,Allahabad Bank,ALLA0212579,231010532,JAMUI,"VILL-JAMUI, TEHSIL-MARIHAN, DISTRICT-MIRZAPUR(U.P)","MR. ANIL KUMAR DOHRAY, 9839524706, MR. MANIMESH KUMAR",JAMUI,MIRZAPUR,UTTAR PRADESH
ALLA0212580,Allahabad Bank,ALLA0212580,231010516,LACHHA PATTI,"VILL-LACHHA PATTI, POST-BEERSHAHPUR, DISTRICT- MIRZAPUR(U.P), PIN CODE-231001","MR. NARENDRA PRASAD GUPTA, 9453866158, MR. AVINASH KUMAR",BEERSHAHPUR,MIRZAPUR,UTTAR PRADESH
ALLA0212581,Allahabad Bank,ALLA0212581,APPLIED,FATEHGARH SAHIB,"SCO 10-11, MODERN VALLEY, CHANDIGARH ROAD, FATEHGARH SAHIB (PUNJAB) PIN - 140406","GS BHATIA : 9316481495 , SS BAHIA : 9779066003",FATEHGARH SAHIB,FATEHGARH SAHIB,PUNJAB
ALLA0212582,Allahabad Bank,ALLA0212582,160010016,DERA BASI,"NEAR SWAGHAT REGENCY,CHANDIGARH AMBALA HIGHWAY, DERA BASI,DIST - MOHALI (PUNJAB)   PIN - 140507","JPS TALWAR : 9815936039 , NIKHAL : 9034855190",SAS NAGAR(MOHALI),RUPNAGAR,PUNJAB
ALLA0212583,Allahabad Bank,ALLA0212583,APPLIED,SAMANA,"NEAR OLD BUS STAND, NEAR STATE BANK OF PATIALA, PRATAP COLONY SAMANA DISTT PATIALA 147101","R.K. GUPTA : 9417088556 , SUYASH NEGI : 7508306029",SAMANA,PATIALA,PUNJAB
ALLA0212584,Allahabad Bank,ALLA0212584,APPLIED,DHURI,"M K BYE PASS, NEAR HARYALI KISSAN BAZAR DHURI DISTT SANGRUR (PUNJAB) 148024","SUBHASH CHANDER :  9463243698 , VIJAY : 7837343446",DHURI,SANGRUR,PUNJAB
ALLA0212585,Allahabad Bank,ALLA0212585,APPLIED,SULTANPUR LODHI,"GURDWARA BER SAHIB ROAD, GILL MARKET, SULTANPUR LODHI DISTT KAPURTHALA (PUNJAB) 144626","LAXMI NARAYAN : 9501348411 , AMIT KALSI : 8427230040",SULTANPUR LODHI,KAPURTHALA,PUNJAB
ALLA0212586,Allahabad Bank,ALLA0212586,208010024,AXIS UNIVERSITY CAMPUS HATHIPUR,"AXIS UNIVERSITY CAMPUS, HATHIPUR, MAHARAJPUR, KANPUR NAGAR UP, PIN-209402","MR. ANIL KUMAR SHUKLA, MS. SWATI SHARMA",KANPUR,KANPUR CITY,UTTAR PRADESH
ALLA0212587,Allahabad Bank,ALLA0212587,700010194,COMMAND HOSPITAL,"P-9, COMMAND HOSPITAL COMPLEX, II LINES, ALIPORE,KOLKATA -700027","SUROJIT CHAKRABORTY, 918017421384, DEBOJYOTI DAS, 919903110601",KOLKATA,KOLKATA,WEST BENGAL
ALLA0212588,Allahabad Bank,ALLA0212588,600010004,KALAPATTI,"S.F.NO.287/1, SITRA ROAD, KALAPATTI, COIMBATORE. PIN - 641305","SHRI J.RAJA, 9363241226, MS. SATHYA BHARATHI, 0422-3222889",KALAPATTI,COIMBATORE,TAMIL NADU
ALLA0212589,Allahabad Bank,ALLA0212589,759010102,ANGUL,"PTC CHOWK, UMASHANKAR BAZAR, AT/PO:TURANGA, DIST:ANUGUL PIN:759123","U C MISHRA, KHETRABASI BEHERA, 9437419353, 9861801096",ANGUL,ANGUL,ORISSA
ALLA0212590,Allahabad Bank,ALLA0212590,700010196,KHURIGHOCHHI,"VILL KHURIGACHI, PO: SONARPUR, DIST-SOUTH 24 PARGANAS, WEST BENGAL, PIN- 700150","TAPAN KR MONDAL, 9874290658, JOYDEB HALDER, 9477616265",SHONEPURHAT,SOUTH 24 PARGANAS,WEST BENGAL
ALLA0212591,Allahabad Bank,ALLA0212591,132010152,SAMALKHA,"ALLAHABAD BANK, 1214/3 WARD NO. 4, RAILWAY ROAD, NEAR OLD BUS STAND, SAMALKHA,HARYANA PIN-132101","SHRI RANDHIR SINGH, MISS SANJOGITA, 9138211122, 9896600565",SAMALKHA,PANIPAT,HARYANA
ALLA0212592,Allahabad Bank,ALLA0212592,458010052,JAVAD,"ALLAHABAD BANK, 2162/1/1 JAVAD MORVAN ROAD, OPPOSITE NAGARPALIKA, TEHSIL JAVAD, DISTRICT NEEMUCH","MUKESH SONI, 09039782055, HEMLATA PAWAR, 09770185775",JAWAD,NEEMUCH,MADHYA PRADESH
ALLA0212593,Allahabad Bank,ALLA0212593,APPLIED,KERA KHERA,NEAR BUS STAND VPO KERA KHERA DISTT FAZILKA (PUNJAB) 152117,"GHANSHYAM SHARMA : 9914808702 , HEMANT WATTS : 9872033722",FAZILKA,FEROZPUR,PUNJAB
ALLA0212594,Allahabad Bank,ALLA0212594,APPLIED,MULLANPUR GARIBDASS,"KHARA NO 1598/1599 , MAIN CHANDIGARH ROAD, MULLANPUR GARIBDASS, TEHSIL - KHRAR, DIST - MOHALI, PUNJAB, PIN - 140907",MR. AMAN PASSI : 98159-25312,MULLANPUR GARIBADAS,MULLANPUR GARIBADAS,RUPNAGAR
ALLA0212595,Allahabad Bank,ALLA0212595,APPLIED,KURALI,SHOW ROOM NUMBER 225 WARD NO. 9 CHANDIGARH AMRITSAR HIGHWAY KURALI DISTT MOHALI (PUNJAB) 140103,"A.C. THAKUR : 7837001442 , SANDEEP : 8146196936",KURALI,RUPNAGAR,PUNJAB
ALLA0212596,Allahabad Bank,ALLA0212596,APPLIED,LALRU,"PREM NAGAR, NEAR GULMOHAR PLAZA CHANDIGARH AMBALA HIGHWAY LALRU DISTT MOHALI (PUNJAB) 140501","ASHOK GARG : 9501805636 , MANISH NEHARIA : 9023285720 ",LALRU,PATIALA,PUNJAB
ALLA0212597,Allahabad Bank,ALLA0212597,APPLIED,RAMPURA PHUL,NEAR MALL GODOWN ROAD RAMPURA PHUL DISTT BATHINDA (PUNJAB) 151103,"SANJEEV PURI : 9855528650 , VIKAS LOHAN : 9729978780",RAMPURA PHUL,BATHINDA,PUNJAB
ALLA0212598,Allahabad Bank,ALLA0212598,APPLIED,GANDUAN,"OPPOSITE SOCIETY OFFICE VPO GANDUAN, TEHSIL SUNAM DISTT SANGRUR (PUNJAB) 148030","SATISH KUMAR : 9810280155 , NIRBHAY KUMAR : 9357923369",SUNAM,SANGRUR,PUNJAB
ALLA0212599,Allahabad Bank,ALLA0212599,380010017,SANAND,"SURVEY NO 31-32, GROUND FLOOR, NAL SAROVAR CIRCLE, SANAND VIRAMGAM HIGHWAY, SANAND-382110","ANUPAM GUPTA, 9929210527, HITESH VAGHELA, 9724592936",SANAND,AHMADABAD,GUJARAT
ALLA0212600,Allahabad Bank,ALLA0212600,466010501,MEHATWARA,"SEL FACTORY INDORE BHOPAL HIGHWAY,VILLAGE MEHATWARA,TEHSIL-JAWAR,DISTRICT -SEHORE,MADHYA PRADESH","SHRI AKHILESH SINGH, 7898071036,SHRI C.K. KUNDWANI, 7560259080",JAWAR,SEHORE,MADHYA PRADESH
ALLA0212601,Allahabad Bank,ALLA0212601,458010502,MALHARGARH,"ANSARI COMPLEX, OPP. POLICE THANA . MAHU, NEEMUCH ROAD, MALLAHARGARH. DIST- MANDSAUR (MP), PIN-458339","R. C. YADAV, 9179131041, MANGAL SINGH GORANA, 9753642466",MALHARGARH,MANDSAUR,MADHYA PRADESH
ALLA0212602,Allahabad Bank,ALLA0212602,APPLIED FOR,TILAPARA,"ICARE BIRBHUM, CO BIET, TILAPARA, PO SURI, DIST BIRBHUM, WEST BENGAL 731101","SHRI VISHAL SINHA 8981439619, SHRI MD MOSHIN NAWAZ,8145252266",SURI,BIRBHUM,WEST BENGAL
ALLA0212603,Allahabad Bank,ALLA0212603,APPLIED FOR,SAHNEWAL,"H.NO.29, MAIN GRAIN MANDI, SHANEWAL, DISTRICT LUDHIANA PUNJAB- 141120","SHRI P K JOSHI, 09876677494, SHRI RAMKESH MEENA, 09876677494 ",SAHNEWAL,LUDHIANA,PUNJAB
ALLA0212604,Allahabad Bank,ALLA0212604,APPLIED FOR,JANDIALA GURU,"KHASRA NO. 430/574, OPPOSITE KHERA PALACE, MAIN JANDIALA BAZAR, JANDIALA GURU, DISTRICT AMRITSAR, PUNJAB- 143115","SHRI B S MUNDER, 09417145424, SHRI SACHIN, 0183 2430400",JANDIALA GURU,AMRITSAR,PUNJAB
ALLA0212605,Allahabad Bank,ALLA0212605,APPLIED FOR,LEHRAGAGA,"ADJACENT GOVT. GIRLS HIGH SCHOOL, NEAR MANDI WALA GURUDWARA, LEHRAGAGA, DISTRICT SANGRUR PUJAB- 148031","SHRI KAMAIL SINGH, 09872205458, SHRI SUKHJINDER PAL SINGH, 099155610210",LEHRAGAGA,SANGRUR,PUNJAB
ALLA0212606,Allahabad Bank,ALLA0212606,APPLIED,TALWANDI SABO,"RORI ROAD, NEAR SBI , TALWANDI SABO, DISTT - BATHINDA, PUNJAB PIN - 151302",MR. SUDESH KUMAR : 94176-16344,TALWANDI SABO,TALWANDI SABO,BATHINDA
ALLA0212607,Allahabad Bank,ALLA0212607,APPLIED FOR,GOINDWAL SAHIB,"CHOWK SANT BABA KARTAR SINGH, KAPURTHALA - TARN TARAN MAIN ROAD,GOINDWAL SAHIB, DISTT - TARN TARAN, PUNJAB PIN 143422","VIJAY KUMAR ARORA, 9592643005",GOINDWAL SAHIB,AMRITSAR,PUNJAB
ALLA0212609,Allahabad Bank,ALLA0212609,301012501,NEEMRANA,"RIICO COMPLEX, NEAR POLICE STATION,NEEMRANA. DISTT. ALWAR (RAJASTHAN). PIN CODE 301705","MR. DINSEH CHAND GUPTA, 8290945579",NEEMRANA,ALWAR,RAJASTHAN
ALLA0212610,Allahabad Bank,ALLA0212610,110010097,BAJGHERA,"NEAR SHIV MANDIR, NAJAFGARH ROAD, VILLAGE- BAJGHERA, P.O. PALAM VIHAR, TEHSIL & DISTRICT- GURGAON, HARYANA- 122017","SHRI SANJAY GOYAL, 09968253372, SHRI ANKUR BISHT, 09990845548",GURGAON RURAL,GURGAON,HARYANA
ALLA0212612,Allahabad Bank,ALLA0212612,APPLIED FOR,RATUA,"VILL-RATUA,P.O.-RATUA. PS & DIST - MALDA TEL - 03513-266060 WEST BENGAL - 732205","RAJ KUMAR YADAV, 09163187012, SUDHIR MODI, 8981645189",RATUA,MALDAH,WEST BENGAL
ALLA0212614,Allahabad Bank,ALLA0212614,APPLIED FOR,AMLAI,"VILL & PO AMALI, PS - BHARATPUR, DIST-MURSHIDABAD, WEST BENGAL PIN -742301","SHRI MANISH KUMAR 9547624242, SHRI TRIPATHI",MURSHIDABAD,MURSHIDABAD,WEST BENGAL
ALLA0212615,Allahabad Bank,ALLA0212615,123010003,BAWAL,"ALLAHABAD BANK, OPP. HARYANA SURAJ MALTING LTD., REWARI ROAD, BANNIPUR CHOWK, BAWAL, DIST- REWARI. HARYANA, PIN- 123010003","SHRI BALDEV KRISHAN, 09468020922, ANOOP SINGH, 09467722922",BAWAL,REWARI,HARYANA
ALLA0212616,Allahabad Bank,ALLA0212616,110010099,RAI,"ALLAHABAD BANK, OPPO. RAJEEV GANDHI EDUCATION CITY, MAIN G. T. ROAD, V.P.O RAI, DIST- SONEPAT, HARYANA-131029","SHRI N. S. MALIK, 09896258934",RAI,SONIPAT,HARYANA
ALLA0212617,Allahabad Bank,ALLA0212617,174010002,SUNDERNAGAR,"ALLAHABAD BANK, N.H. 21, NEAR PUNJAB NATIONAL BANK, SUNDERNAGAR, DIST-MANDI, HIMACHAL PRADESH, PIN-175002","SHRI RAMESH LAL, 09318513271",SUNDAR NAGAR,MANDI,HIMACHAL PRADESH
ALLA0212618,Allahabad Bank,ALLA0212618,APPLIED FOR,PAIGA,"ALLAHABAD BANK, PAIGA FARM, KASHIPUR ALIGANJ ROAD, VILLAHE- PAIGA, P.O.- MAHUA KHERA GANJ, DISTT.- U.S.NAGAR, UTTARAKHAND, PIN-244713","D KESTWAL, 9058539922, 05947-211622, NARENDER PRATAP, 05947-211622",PAIGA,SARAN,BIHAR
ALLA0212619,Allahabad Bank,ALLA0212619,793010102,LUMSHNONG,"NATIONAL HIGHWAY NO.44, NEAR STAR CEMENT FACTORY GATE, VILL-LUMSHNONG, JAINTIA HILLS (MEGHALAYA), LUMSHNONG-793200","ELAR HRANGATE, 9856223460, SHINING STAR MUSKAT, 9862237870",GUWAHATI,KAMRUP,ASSAM
ALLA0212620,Allahabad Bank,ALLA0212620,110010098,DHARUHERA,"BEST TECH CITY CENTRE, SECTOR 7, NH8, NEAR HERO HONDA PLANT, DHARUHERA HARYANA - 122106","MR. MAHAVIR SINGH - 90177157560, MR.NAROM BASANTA - 01274-242068",DHARUHERA,REWARI,HARYANA
ALLA0212621,Allahabad Bank,ALLA0212621,APPLIED FOR,BAGWARA,"VILL-BAGWARA, POST-LARUARA,VIA-SUHIRDNAGAR,DIST-BEGUSARAI,PIN-851218","RAJESH KUMAR-9835477214, VIJAY KUMAR-8900015383",BEGUSARAI,BEGUSARAI,BIHAR
ALLA0212622,Allahabad Bank,ALLA0212622,APPLIED FOR,MAHENDRAPUR,"VILL-MAHENDRAPUR,POST-BHOGA BHATGAMA,DIST-PURNEA,PIN-854337","VIKAS KUMAR-9473454874, ASWINI KUMAR-9334724862",PURNEA,PURNIA,BIHAR
ALLA0212623,Allahabad Bank,ALLA0212623,110010102,NUH,"CIVIL LINES ROAD, MAIN CIVIL LINES, NUH DIST. MEWAT, HARYANA - 122107","MR. BINOD KUMAR GUPTA - 9717021630, MR.MANGLA - 01267- 274003",NUH,GURGAON,HARYANA
ALLA0212624,Allahabad Bank,ALLA0212624,APPLIED FOR,GAURIGANJ,"ALLAHABAD BANK, OPP. S.P.OFFICE, GAURIGANJ, DISTT.CHATRAPATI SAHUJI MAHARAJNAGAR (U.P) PIN:227409","MR MOHD FAFIM, 09452464632, MR RAJEEV SINGH, 09452271079",GAURIGANJ,SULTANPUR,UTTAR PRADESH
ALLA0212625,Allahabad Bank,ALLA0212625,110010103,BISRAKH,"OPP. PRITHVIJEE HOUSE, VILLAGE & POST OFFICE BISRAKH, GREATER NOIDA, DIST GAUTAM BUDDH NAGAR, U.P PIN 201307","MR RAJAT GUPTA -9711847079,MR ANIL KUMAR - 9911838151",BISRAKH,GAUTAM BUDDHA NAGAR,UTTAR PRADESH
ALLA0212626,Allahabad Bank,ALLA0212626,APPLIED FOR,LUDHIANA SHIVPURI,"DHARAMSALA ROAD, SHIVPURI MANDIR, SHIVPURI, LUDHIANA, PUNJAB PIN 141008","ASHOK SHARMA, 9872804527",LUDHIANA,LUDHIANA,PUNJAB
ALLA0212627,Allahabad Bank,ALLA0212627,141010011,LUDHIANA GILL ROAD,"ABOVE SAI MOTORS, GILL ROAD, GILL ROAD LUDHIANA, PUNJAB PIN 141003","RL ARORA, 9417425487",GILL,LUDHIANA,PUNJAB
ALLA0212628,Allahabad Bank,ALLA0212628,461010501,RAISALPUR,"GRAM PANCHAYAT BHAWAN, VILLAGE & POST RAISALPUR, DIST HOSHANGABAD, M.P. 461111"," M. C. SHARMA 9425360739,RAM VILAS SINGH KUSHWAHA 07572-273910",HOSHANGABAD,HOSHANGABAD,MADHYA PRADESH
ALLA0212629,Allahabad Bank,ALLA0212629,110010101,TAURU,"WARD NO 4, MAIN SOHNA REWARI ROAD, OPP. CITY POLICE CHECK POST, TAURU (DIST.MEWAT) HARYANA - 122105","MR K M AGGARWAL - 9953540178, MR.AMITENDU RAWAT - 01267-282047",TAURU,GURGAON,HARYANA
ALLA0212630,Allahabad Bank,ALLA0212630,110010100,PATAUDI,NEAR VISHWAS COLLEGE OF EDUCATION,"MR. S.K.RAJORIA - 8901391288  , MR.PURAN CHAND - 9818743619",PATAUDI,GURGAON,HARYANA
ALLA0212631,Allahabad Bank,ALLA0212631,431010005,SHENDRA,"H/O. SRI RAM BHAUSAHEB SHELKE, PLOT NO 24, VILL/PO-KUBHEPHAL,(SHENDRA MIDC), AURANGABAD - JALNA ROAD, DIST-AURANGABAD (MAHARASHTRA), PIN CODE - 431008","MS RASHMI DONGRE, 9422114691, MS GAURI KULKARNI, 9890469050",AURANGABAD,AURANGABAD,MAHARASHTRA
ALLA0212632,Allahabad Bank,ALLA0212632,APPLIED FOR,MANDI AHMEDGARH,"CHAPPAR ROAD, NEAR SBI, AHMEDGARH, DISTT- SANGRUR, PUNJAB PIN - 148021","SS SAUNTHE, 09878644415",AHMEDGARH,SANGRUR,PUNJAB
ALLA0212633,Allahabad Bank,ALLA0212633,APPLIED FOR,GIDDERBAHA,"OPP. PREET GAS AGENCY, CIRCULAR ROAD, GIDDERBAHA, PUNJAB PIN 152101","TK BANSAL, 09888310739",GIDDAR BAHA,MUKTSAR,PUNJAB
ALLA0212634,Allahabad Bank,ALLA0212634,APPLIED FOR,JAMALPUR,"PLOT NO 3673, B/31, JAMANLPUR , DISTT - LUDHIANA, PUNJAB PIN 141010","ABHISHEK RANJAN, 09417046377",LUDHIANA,LUDHIANA,PUNJAB
ALLA0212635,Allahabad Bank,ALLA0212635,APPLIED FOR,AMRTISAR BHAGTAWALA GATE,"SCO 626-627, NEW GRAIN MANDI, BHAGTAWALA, NEAR RAILWAY CROSSING, AMRITSAR, PUNJAB PIN 143001","KL LAHORIA, 09530805970",AMRITSAR,AMRITSAR,PUNJAB
ALLA0212636,Allahabad Bank,ALLA0212636,284010152,BUROGAON,"VILL & POST- BUROGAON(CHIGLAUA), PARGANA-BANPUR, TEHSIL- MEHRAUNI, DISTT-LALITPUR,PINCODE-284123,UP","SRI VIRESH SRIVASTAVA, 9415589313, SRI MAITHLI SARAN SANWLA, 9415319633",BANPUR,LALITPUR,UTTAR PRADESH
ALLA0212637,Allahabad Bank,ALLA0212637,301010502,NAGLA RAISIS,"VILLAGE NAGLA RAISIS, KATORIWALA TIBARA, OPPOSITE HP PETROL PUMP, DISTT. ALWAR, RAJASTHAN – 301001","SH. SURESH CHAND SHARMA (MANAGER), 9414973457, SH. HEMANT SONI, 7737748561",ALWAR,ALWAR,RAJASTHAN
ALLA0212638,Allahabad Bank,ALLA0212638,271010304,SITKAHVA,"VILL- SITKAHVA, BHINGALAXMANPUR ROAD BANTIHVA, DIST- SITKAHVA UP- 271831","PREM CHAND KUMAR, 7408799166, MOHAN SINGH, 9452124885",SIRSIYA,SHRAVASTI,UTTAR PRADESH
ALLA0212639,Allahabad Bank,ALLA0212639,440010010,HINGNA ROAD,"SURVEY NO - 127/2,PRIYADARSHANI ENGINEERING COLLEGE CAMPUS,HINGNA ROAD, HINGNA,DIST-NAGPUR (MAHARASHTRA),PIN CODE - 440019","MR ASHISH B BAHILE, 9975069627,MR RAVITEJA SANKURI, 9730959849",HINGNA,NAGPUR,MAHARASHTRA
ALLA0212640,Allahabad Bank,ALLA0212640,136010102,LADWA,"ALLAHABAD BANK, LADWA BRANCH, CHANNI PLAZA, RADAUR ROAD, LADWA, DISTT KURUSHETRA, PIN-136132","ANIL KUMAR,9468150718",LADWA,KURUKSHETRA,HARYANA
ALLA0212641,Allahabad Bank,ALLA0212641,136010154,CHEEKA,"ALLAHABAD BANK, CHEEKA BRANCH, KARTAR ENCLAVE, KAITHAL ROADKAITHAL ROAD, NEAR ANAJ,MANDI, CHEEKA TEHSIL -GULHA, DISTT KAITHAL, HARYANA,PIN-136034","RAVINDER PAL,9996946946",CHEEKA,KAITHAL,HARYANA
ALLA0212642,Allahabad Bank,ALLA0212642,132010104,NISSING,"ALLAHABAD BANK, NISSING BRANCH, KARNAL KAITHAL ROAD, OPP CIVIL HOSPITAL, NISSING DISTT KARNAL, HARYANA-132024","NARESH NEHRA, 9416458568, JAIVEER SINGH, 8684903300",KARNAL,KARNAL,HARYANA
ALLA0212644,Allahabad Bank,ALLA0212644,231010176,KACHNARWA,"ALLAHABAD BANK, VILLAGE & PO KACHNARWA, BLOCK CHOPAN, DISTRICT SONEBHADRA, UTTAR PRADESH,PIN-232221","UMA SHANKAR RAM, BR MANAGER, MOB 9450761129, AMIT KUMAR SINGH, OFFICER, MOB NO 9453561915",CHOPAN,SONBHADRA,UTTAR PRADESH
ALLA0212645,Allahabad Bank,ALLA0212645,203010003,PARWANA MAHMOODPUR,"VILL PO PARWANA MAHAMOODPUR, DISTT BULAND SAHAR, U.P.- 245407","SH. PRAVEEN KUMAR SHARMA-9411438638, SH. ANIL KUMAR SHARMA",BULANDSHAHR,BULANDSHAHR,UTTAR PRADESH
ALLA0212647,Allahabad Bank,ALLA0212647,613010002,THANJAVUR,"S F NO. 326 BY A 11, MEDICAL COLLEGE ROAD, MANAGALAPURAM, THANJAVUR PIN- 613007, TAMIL NADU","SHRI RAGHAVAN NATARAJAN, S CHANDRASEKARAN",THANJAVUR,THANJAVUR,TAMIL NADU
ALLA0212648,Allahabad Bank,ALLA0212648,210010365,MAHOTRA,"OPPOSITE TATHAGAT GYANSTHALI ATARRA ROAD, ATARRA BANDA U.P. 210201","A K JAIN  9415588341 , BRAJESH KR. TRIPATHI  9839392727 ",ATARRA,BANDA,UTTAR PRADESH
ALLA0212649,Allahabad Bank,ALLA0212649,110010107,MODEL TOWN,C-1-30 MODEL TOWN III,"MR P P S VOHRA, 9350744343, MS LATA RAMESH, 9811075203",DELHI,DELHI,DELHI
ALLA0212650,Allahabad Bank,ALLA0212650,APPLIED FOR,DHULIAN,"DULIAN MAIN ROAD, NEAR DHULIAN MUNICIPALITY, PO DHULIAN, DIST- MURSHIDABAD, WEST BENGAL, PIN 742202","SHRI VIVEK AGARWAL 9932179926, SHRI SUMAN JHA",DHULIAN,MURSHIDABAD,WEST BENGAL
ALLA0212651,Allahabad Bank,ALLA0212651,APPLIED FOR,TEHATTA,"VILL TEHATTA BAZAR, NEAR BDO OFFICE, PO- TEHATTA, DIST-NADIA, WEST BENGAL, PIN 741160","SHRI NEERAJ KUMAR SHANDHIYA 9378327217, VISHAL KUMAR 9679822607 ",MURSHIDABAD,MURSHIDABAD,WEST BENGAL
ALLA0212652,Allahabad Bank,ALLA0212652,636010004,NAMAKKAL,"D-NO-173/178 AND 173-A, SANTHAPETTAIPUDUR, PARAMATHI ROAD, NAMAKKAL, PIN- 637001","SHRI N MADHAVAN, MAITHILY",NAMAKKAL,NAMAKKAL,TAMIL NADU
ALLA0212653,Allahabad Bank,ALLA0212653,110010108,NANGLOI,"18 D, ASHOK MOHALL, NAGLOI CHOWK, MAIN ROHTAK ROAD, NANGLOI ","MR B S RATHEE, 9911145502, MR T D TALREJA, 9968241486",DELHI,DELHI,DELHI
ALLA0212655,Allahabad Bank,ALLA0212655,110010104,FARIDABAD,"1087– C, PURAN ENCLAVE, MAIN MARKET, OLD FARIDABAD ","MR MUKESH KUMAR, 9868334235, MR AMARJEET SURI, 9871217082",FARIDABAD,FARIDABAD,HARYANA
ALLA0212656,Allahabad Bank,ALLA0212656,110010106,UDYOG VIHAR,"H.K.RAO COMPLEX, PLOT NO.420, OLD DELHI ROAD, DUNDHERA UDYOG VIHAR","MR SANJAY GOEL, 9968253372, MR MAMTA, 9819157021",DELHI,DELHI,DELHI
ALLA0212657,Allahabad Bank,ALLA0212657,110010105,GURGAON SECTOR 56,"SCO 60, HUDA MARKET, SECTOR 56","MR ROHTASH SINGH, 9899567717, MR VARUN, 9891369936",DELHI,DELHI,DELHI
ALLA0212658,Allahabad Bank,ALLA0212658,APPLIED FOR,LUDHIANA RAJGURU NAGAR,"SCF-2 AND 3, MAIN MARKET, RAJGURU NAGAR, LUDHIANA, PUNJAB, PIN-141012","SHRI RAJESH SHUKLA, 07837001454, SHRI SANJEEV, 07837001454",LUDHIANA,LUDHIANA,PUNJAB
ALLA0212659,Allahabad Bank,ALLA0212659,APPLIED FOR,NUMAHAL,"GAHIR TIMBER MERCHANT, PIHLLAUR ROAD, NUMAHAL, DISTRICT JALANDHAR PUNJAB, PIN-144039","SHRI PARAMJIT SINGH, 09464014452, SHRI NIKHIL, 0987699149",NURMAHAL,JALANDHAR,PUNJAB
ALLA0212660,Allahabad Bank,ALLA0212660,APPLIED FOR,PINDRA,VILL & PO PINDRA  BLOCK MAJHGAWAN  DISTT SATNA  PIN-485331,"M L YADAV 9993309847,CHANDRESH AGRWAL 9691965107",MAJHGAWAN,SATNA,MADHYA PRADESH
ALLA0212661,Allahabad Bank,ALLA0212661,APPLIED FOR,ANJIRA,"VILL ANJIRA BALICHANDRASAHI CHHAK, AT SARAGADA MUKUNDAPUR , VIA JENAPUR, DIST JAJPUR, PIN-755023 ODISHA","MIHIR MOHAPATRA, 8018486339, JANAKI PRASAD PATANAYAK",JAJPUR ROAD,JAJPUR,ORISSA
ALLA0212662,Allahabad Bank,ALLA0212662,174010102,UNA,"ALLAHABAD BANK, OPPO- D.C. OFFICE, SANTOSHGARH ROAD, UNA, PIN-174303","MR. ROOP SINGH THAKUR , 08894379395, MR. AJAY KUMAR",UNA,UNA,HIMACHAL PRADESH
ALLA0212663,Allahabad Bank,ALLA0212663,132010302,TARAORI,"ALLAHABAD BANK, SONKA ROAD, TAROARI, DISTT- KARNAL, PIN-132116","SHRI S.C. SAINI, 9478489658, SHRI  PRADEEP KUMAR, 9811307408",TARAORI,KARNAL,HARYANA
