ID,BANKNAME,IFSC,MICR_CODE,BRANCH,ADDRESS,CONTACT1,CENTRE,DISTRICT,STATE
PRTH0000001,Prathama Bank,PRTH0000001,,"PRATHAMA BANK, HEAD OFFICE","PRATHAMA BHAVAN, RAM GANGA VIHAR, MORADABAD",05912455176,MORADABAD,MORADABAD,UTTAR PRADESH
PRTH0011000,Prathama Bank,PRTH0011000,,RO MORADABAD,"PRATHAMA BHAVAN, RAM GANGA VIHAR, MORADABAD",09837001680,MORADABAD,MORADABAD,UTTAR PRADESH
PRTH0011009,Prathama Bank,PRTH0011009,,AGHWANPUR,P.O. AGHWANPUR TEH. MORADABAD DISTT. MORADABAD.,05912511354,AGHWANPUR,MORADABAD,UTTAR PRADESH
PRTH0011011,Prathama Bank,PRTH0011011,,MOONDA PANDAY,P.O. MOONDA PANDAY TEH.MORADABAD DISTT. MORADABAD.,05912255014,MOONDAPANDE,MORADABAD,UTTAR PRADESH
PRTH0011012,Prathama Bank,PRTH0011012,,PAKBARA,P.O. PAKBARA TEH.MORADABAD DISTT. MORADABAD.,05912360317,PAKWARA,MORADABAD,UTTAR PRADESH
PRTH0011015,Prathama Bank,PRTH0011015,,R. N SAHASPUR,P.O. R.N. SAHASPUR TEH.BILARI DISTT. MORADABAD.,05921270702,MORADABAD,MORADABAD,UTTAR PRADESH
PRTH0011016,Prathama Bank,PRTH0011016,,KUNDARKI,P.O. KUNDERKI TEH.BILARI DISTT. MORADABAD.,05921222225,KUNDARKI,MORADABAD,UTTAR PRADESH
PRTH0011025,Prathama Bank,PRTH0011025,244843002,MORADABAD MAIN,"A-77 GANDHI NAGAR, PRINCE ROAD, P.O. MORADABAD, DISTT MORADABAD",05912491046,MORADABAD,MORADABAD,UTTAR PRADESH
PRTH0011026,Prathama Bank,PRTH0011026,,SARKARAKHAS,P.O. SARKARA KHAS TEH.MORADABAD DISTT. MORADABAD,05912257036,SARKARA KHAS,MORADABAD,UTTAR PRADESH
PRTH0011030,Prathama Bank,PRTH0011030,,FATEHPUR VISHNOI,P.O. FATHPUR VISHNOI TEHSIL KANTH DISTT. MORADABAD,05922227022,FATEHPUR VISHNOI,MORADABAD,UTTAR PRADESH
PRTH0011042,Prathama Bank,PRTH0011042,,SEONDARA,"P.O. SEONDARA TEHSIL BILARI, DISTT. MORDABAD",05921244294,SEONDARA,MORADABAD,UTTAR PRADESH
PRTH0011048,Prathama Bank,PRTH0011048,,LODHIPUR JAWAHAR NAGAR,P.O. KAZIPURA TEHSIL. MORADABAD DISTT. MORADABAD,05912483494,LODHIPUR,MORADABAD,UTTAR PRADESH
PRTH0011052,Prathama Bank,PRTH0011052,244843006,HARTHALA,P.O. HARTHALA TEHSIL. & DISTT. MORADABAD,05912450253,HARTHALA,MORADABAD,UTTAR PRADESH
PRTH0011055,Prathama Bank,PRTH0011055,,JARGAON,P.O. JARGAON TEHSIL. CHANDAUSI DISTT. MORADABAD,9756799055,JARGOAN,MORADABAD,UTTAR PRADESH
PRTH0011058,Prathama Bank,PRTH0011058,244843003,LALBAGH,P.O. MORDABAD TEHSIL.&DISTT. MORADABAD,9756799058,MORADABAD,MORADABAD,UTTAR PRADESH
PRTH0011059,Prathama Bank,PRTH0011059,244843004,KATGHAR,P.O. MAQBARA TEHSIL.MORDABAD DISTT. MORADABAD,9756799059,MORADABAD,MORADABAD,UTTAR PRADESH
PRTH0011060,Prathama Bank,PRTH0011060,,TAJPUR MAAFI,P.O. BHANSIA TEHSIL. & DISTT. MORDABAD,9756799060,TAJPUR MAFI,MORADABAD,UTTAR PRADESH
PRTH0011063,Prathama Bank,PRTH0011063,,SAKTOO NAGLA,P.O. SARKARA KHAS TEHSIL. & DISTT. MORADABAD,9756799063,SAKTOONAGLA,MORADABAD,UTTAR PRADESH
PRTH0011065,Prathama Bank,PRTH0011065,,AKKA DILARI,P.O. AKKA DILARI TEHSIL.& DISTT. MORADABAD,9756799065,AKKA DILARI,MORADABAD,UTTAR PRADESH
PRTH0011076,Prathama Bank,PRTH0011076,,GWAROO,P.O. GWAROO TEHSIL.BILARI DISTT. MORADABAD,9756799076,GWAROO,MORADABAD,UTTAR PRADESH
PRTH0011077,Prathama Bank,PRTH0011077,,KURADOOMNAGAR,P.O. K.D. NAGAR TEHSIL. BILARI DISTT. MORADABAD,9756799077,KUD-DHOOM NAGAR,MORADABAD,UTTAR PRADESH
PRTH0011078,Prathama Bank,PRTH0011078,,MAJHOLA LINE PAAR,P.O. MAJHOLA LINEPAR TEHSIL. & DISTT. MORADABAD,9756799078,MANJHOLA,MORADABAD,UTTAR PRADESH
PRTH0011086,Prathama Bank,PRTH0011086,,HUSSAINPUR CHIRAWALI,"GAGAN TIRAHA, P.O. SITAPURI  TEHSIL BILARI  DISTT. MORADABAD",9756799086,HUSAINPUR CHIRAWLI,MORADABAD,UTTAR PRADESH
PRTH0011100,Prathama Bank,PRTH0011100,244843005,BANGLA GAON,"P.O. KATCHAHRI, TEHSIL & DISTT. MORDABAD",9756799100,MORADABAD,MORADABAD,UTTAR PRADESH
PRTH0011109,Prathama Bank,PRTH0011109,,KHADAGPUR BAJEY,P.O. MACHHARIYA RLY STATION TEHSIL. & DISTT. MORADABAD,9756799109,KHARAGPURBAJEY,MORADABAD,UTTAR PRADESH
PRTH0011110,Prathama Bank,PRTH0011110,,BAHORANPUR NARAULI,P.O. BAHORANPUR NAROLI VIA RAJAKA SAHASPUR TEHSIL.BILARI DISTT. MORADABAD,9756799110,BAHORANPURNAROULI,MORADABAD,UTTAR PRADESH
PRTH0011138,Prathama Bank,PRTH0011138,,MOHANPUR,P.O. KUNDERKI TEHSIL-BILARI DISTT. MORADABAD,9756799138,MOHANPUR,MORADABAD,UTTAR PRADESH
PRTH0011140,Prathama Bank,PRTH0011140,,SANAI,P.O. SANAI TEHSIL-BILARI DISTT. MORADABAD,9756799140,SANAI,MORADABAD,UTTAR PRADESH
PRTH0011146,Prathama Bank,PRTH0011146,,BHEETKHERA,P.O. HIRAN KHERA TEHSIL & DISTT. MORADABD,9756799146,MORADABAD,MORADABAD,UTTAR PRADESH
PRTH0011147,Prathama Bank,PRTH0011147,,LALATEEKAR,P.O. RAONDA VIA KUNDERKI TEHSIL-BILARI DISTT. MORADABAD,9756799147,LALA TIKAR,MORADABAD,UTTAR PRADESH
PRTH0011162,Prathama Bank,PRTH0011162,,DHAKIA NARU,P.O. NIKAT SUGAR MILL BILARI TEHSIL-BILARI DISTT. MORADABAD,9756799162,DHAKIA NARU,MORADABAD,UTTAR PRADESH
PRTH0011165,Prathama Bank,PRTH0011165,,BILLARI,NEAR MANGAL KA BAZAR DISTT. MORDABAD,9756799165,BILARI,MORADABAD,UTTAR PRADESH
PRTH0011169,Prathama Bank,PRTH0011169,244843007,RAM GANGA VIHAR,"P.O. RAMGANGA VIHAR, TEHSIL & DISTT.MORADABAD",9756799169,MORADABAD,MORADABAD,UTTAR PRADESH
PRTH0011170,Prathama Bank,PRTH0011170,,KARULA,"P.O. KARULA, THE & DISTT. MORADABAD",9756799170,MORADABAD,MORADABAD,UTTAR PRADESH
PRTH0011172,Prathama Bank,PRTH0011172,244843008,RAMPUR ROAD,"RAMPUR ROAD,DISTT:- MORADABAD",9756799172,MORADABAD,MORADABAD,UTTAR PRADESH
PRTH0011175,Prathama Bank,PRTH0011175,,TOWN HALL,"TOWN HALL BUDH BAZAR STN. ROAD MORADABAD,DISTT:- MORADABAD",9756799175,MORADABAD,MORADABAD,UTTAR PRADESH
PRTH0011182,Prathama Bank,PRTH0011182,,HAKEEMPUR,"VILL. HAKIMPUR, POST FATEHPUR VISHNOI, TEHSIL KANTH, DISTT, MORADABAD",9756799182,MORADABAD,MORADABAD,UTTAR PRADESH
PRTH0011193,Prathama Bank,PRTH0011193,,MANGUPURA,"VILL: MANGOOPURA,P.O. PAKBARA,TEHSIL MORADABAD,DISTT: MORADABAD ",9756799193,MORADABAD,MORADABAD,UTTAR PRADESH
PRTH0011198,Prathama Bank,PRTH0011198,,JALALPUR KHAS,"VILL:JALALPUR KHAS, P.O. KUNDERKI, TEHSIL: BILARI,DISTT: MORADABAD PIN-202413",9756799198,MORADABAD,MORADABAD,UTTAR PRADESH
PRTH0011207,Prathama Bank,PRTH0011207,,DEVAPUR MUSTEHKUM,"VILL. & POST DEVAPUR MUSTAKAM,TEHSIL-MORADABAD,DISTT-MORADABAD, ",8057911207,MORADABAD,MORADABAD,UTTAR PRADESH
PRTH0011213,Prathama Bank,PRTH0011213,,CHHABRA,"VILL & POST CHHABRA,TEHSIL-CHANDAUSI, DISTT-MORADABAD, PIN-202411 (U.P)",8057911213,MORADABAD,MORADABAD,UTTAR PRADESH
PRTH0011220,Prathama Bank,PRTH0011220,,REETH,"VILL REETH POST DHARAMPUR RATTA,TEHSIL-CHANDAUSI,DISTT-MORADABAD, PIN-202411 (U.P)",8449710220,MORADABAD,MORADABAD,UTTAR PRADESH
PRTH0013000,Prathama Bank,PRTH0013000,,RO THAKURDWARA,"PRATHAMA BANK RO, THANKURADWARA, MORADBAD",9837001685,THAKURDWARA,MORADABAD,UTTAR PRADESH
PRTH0013006,Prathama Bank,PRTH0013006,,SURJAN NAGAR,"P.O. SURJAN NAGAR,TEH. THAKURDWARA  DISTT. MORADABAD.",05912244721,SURJAN NAGAR,MORADABAD,UTTAR PRADESH
PRTH0013007,Prathama Bank,PRTH0013007,,DILARI,"P.O. DILARI TEH., TEH.THAKURDWARA ,DISTT. MORADABAD.",05912249370,DILARI,MORADABAD,UTTAR PRADESH
PRTH0013021,Prathama Bank,PRTH0013021,,PEEPAL SANA,P.O. PEEPALSANA TEH.MORADABAD DISTT. MORADABAD.,05912247806,PIPALSANA,MORADABAD,UTTAR PRADESH
PRTH0013024,Prathama Bank,PRTH0013024,,SULTANPUR DOST,P.O. SULTANPUR DOST TEH THAKURDWARA DISTT.MORADABAD,05912248228,SULTANPUR DOST,MORADABAD,UTTAR PRADESH
PRTH0013045,Prathama Bank,PRTH0013045,,SHARIF NAGAR,"P.O. SHAREEF NAGAR,TEHSIL THAKURDWARA,DISTT. MORADABAD",05912243426,SHAREEF NAGAR,MORADABAD,UTTAR PRADESH
PRTH0013046,Prathama Bank,PRTH0013046,,JAHANGIRPUR,"P.O. JAHANGIRPUR, TEHSIL THAKURDWARA DISTT. MORADABAD",05912248324,JAHANGEERPUR,MORADABAD,UTTAR PRADESH
PRTH0013050,Prathama Bank,PRTH0013050,,RATUPURA,P.O. RATUPURA TEHSIL.THAKURDWARA DISTT. MORADABAD,05912240331,RATUPURA,MORADABAD,UTTAR PRADESH
PRTH0013051,Prathama Bank,PRTH0013051,,BHAGATPUR TANDA,P.O. BHAGATPUR TANDA TEHSIL.MORDABAD DISTT. MORADABAD,05912258099,BHAGATPUR TANA,MORADABAD,UTTAR PRADESH
PRTH0013061,Prathama Bank,PRTH0013061,,MANPUR,P.O. MANPUR TEHSIL.MORDABAD DISTT. MORADABAD,9756799061,MANPUR,MORADABAD,UTTAR PRADESH
PRTH0013067,Prathama Bank,PRTH0013067,,KARANPUR,P.O. ALIABAD VIA DILARI TEHSIL. THAKURDWARA DISTT. MORADABAD,9756799067,KARANPUR,MORADABAD,UTTAR PRADESH
PRTH0013068,Prathama Bank,PRTH0013068,,KAMALPURI,P.O. KALAJHANDA TEHSIL.THAKURDWARA DISTT. MORADABAD,9756799068,KAMALPURI,MORADABAD,UTTAR PRADESH
PRTH0013080,Prathama Bank,PRTH0013080,,THAKURDWARA,"P.O. & TEHSIL.THAKURDWARA , DISTT. MORADABAD",9756799080,THAKURDWARA,MORADABAD,UTTAR PRADESH
PRTH0013082,Prathama Bank,PRTH0013082,,BUDHANPUR ALIGANJ,"P.O. B.P. ALIGANJ, TEHSIL. & DISTT. MORADABAD",9756799082,BUDHANPUR(ALIGANJ),MORADABAD,UTTAR PRADESH
PRTH0013085,Prathama Bank,PRTH0013085,,DHAKIA,P.O. DHAKIA JAT TEHSIL. THAKURDWARA DISTT. MORADBAD,9756799085,DHAKIA,MORADABAD,UTTAR PRADESH
PRTH0013104,Prathama Bank,PRTH0013104,,NANHOOWALA,P.O. NANHUWALA TEHSIL.THAKURDWARA DISTT. MORADABAD,9756799104,NANHUWALA,MORADABAD,UTTAR PRADESH
PRTH0013105,Prathama Bank,PRTH0013105,,GOPIWALA,P.O. GOPIWALA TEHSIL. THAKURDWARA DISTT. MORADABAD,9756799105,GOPIWALA,MORADABAD,UTTAR PRADESH
PRTH0013106,Prathama Bank,PRTH0013106,,MAHESHPUR KHEM,P.O. MANPUR TEHSIL & DISTT. MORADABD,9756799106,MAHESHPUR KHEM,MORADABAD,UTTAR PRADESH
PRTH0013122,Prathama Bank,PRTH0013122,,REHTA MAFI,P.O. REHTA MAFI TEHSIL- THAKURDWARA DISTT. MORADABAD,9756799122 ,REHTA MAFI,MORADABAD,UTTAR PRADESH
PRTH0013129,Prathama Bank,PRTH0013129,,BAHERI BRAHAMNAN,P.O. BAHERI BRAHMANAN TEHSIL- THAKURDWARA DISTT. MORADABAD,9756799129,BAHERI BRAHMANAN,MORADABAD,UTTAR PRADESH
PRTH0013130,Prathama Bank,PRTH0013130,,TAGAWALA MANPUR,VIA MANPUR SABIT P.O. DILARI TEHSIL-THAKURDWARA DISTT. MORADABAD,9756799130,TAGAWALA(MANPUR),MORADABAD,UTTAR PRADESH
PRTH0013141,Prathama Bank,PRTH0013141,,BAHADURNAGAR,P.O. BAHADUR NAGAR TEHSIL-THAKURDWARA DISTT. MORADABAD,9756799141,BAHADUR NAGAR,MORADABAD,UTTAR PRADESH
PRTH0013176,Prathama Bank,PRTH0013176,,DULHAPUR,"P.O. TANDA AFZAL ,DISTT:- MORADABAD",9756799176,MORADABAD,MORADABAD,UTTAR PRADESH
PRTH0013192,Prathama Bank,PRTH0013192,,JATPURA,"POST OFFICE: RAJPUR KESARIA,TEHSIL THAKURDWARA, DISTT: MORADABAD  PIN-244001",9756799192,MORADABAD,MORADABAD,UTTAR PRADESH
PRTH0013211,Prathama Bank,PRTH0013211,,CHANDPUR MUSTEHKUM,"VILL & POST CHANDPUR MUSTAKAM,TEHSIL-MORADABAD,DISTT-MORADABAD (U.P),",8057911211,MORADABAD,MORADABAD,UTTAR PRADESH
PRTH0013214,Prathama Bank,PRTH0013214,,KAZIPURA,"VILL. KAZIPUR POST DILARI,TEHSIL THAKURDWARA, DISTT-MORADABAD",8057911214,MORADABAD,MORADABAD,UTTAR PRADESH
PRTH0013237,Prathama Bank,PRTH0013237,,LONGI KALAN,"VILL. LONGI KALAN,P.O.LONIKALAN,TEHSEEL  THAKURDWARA  244601",8476010237,MORADABAD,MORADABAD,UTTAR PRADESH
PRTH0013241,Prathama Bank,PRTH0013241,,SARKARA KHAS (VISHNOI),"VILL.SARKARA KHAS P.O.SARKARAKHAS(VISHNOI) VIA DILARI,MORADABAD",8476010241,SARKARA KHAS,MORADABAD,UTTAR PRADESH
PRTH0013242,Prathama Bank,PRTH0013242,,BARKHERA CHAK,"VILL. BARKHERA CHAK P.O.MANPURA,THAKURDWARA,MORADABAD",8476010242,MORADABAD,MORADABAD,UTTAR PRADESH
PRTH0013244,Prathama Bank,PRTH0013244,,KUA KHERA KHALSA,"VILL.KUA KHERA KHALSA POST SARIFF NAGAR,TEHSIL THAKURDWARA,MORADABAD",8467010244,MORADABAD,MORADABAD,UTTAR PRADESH
PRTH0014010,Prathama Bank,PRTH0014010,,CHHIJLET,P.O. CHHIJLET TEH.KANTH DISTT. MORADABAD.,05912225350,CHIJLET,MORADABAD,UTTAR PRADESH
PRTH0014017,Prathama Bank,PRTH0014017,,GARHEE SALEEMPUR,P.O. GARHI SALEMPUR TEH.KANTH DISTT. MORADABAD.,05912120350,GARHISALEEMPUR,MORADABAD,UTTAR PRADESH
PRTH0014018,Prathama Bank,PRTH0014018,,UMARI KALAN,P.O. UMRI KALAN TEH.KANTH DISTT. MORADABAD.,05922278333,UMRI,MORADABAD,UTTAR PRADESH
PRTH0014047,Prathama Bank,PRTH0014047,,MADHAN,P.O. MADHAN TEHSIL. SAMBHAL DISTT. MORADABAD,9927030636,MADAN,MORADABAD,UTTAR PRADESH
PRTH0014054,Prathama Bank,PRTH0014054,,LODHIPUR RAJPOOT,P.O. PAKBARA TEHSIL. & DISTT. MORADABAD,9756799054,LODHIPUR RAJPUT,MORADABAD,UTTAR PRADESH
PRTH0014071,Prathama Bank,PRTH0014071,,PAIGAMBERPUR,P.O. GAJANA TEHSIL. KANTH DISTT. MORADABAD,9756799071,PAIGAMBARPUR,MORADABAD,UTTAR PRADESH
PRTH0014079,Prathama Bank,PRTH0014079,,MISHRIPUR,P.O. KANTH TEHSIL. KANTH DISTT. MORADABAD,9756799079,MISHRIPUR,MORADABAD,UTTAR PRADESH
PRTH0014107,Prathama Bank,PRTH0014107,,MAGHPURI INAYATPURI,P.O. CHHIJLET VIA KANTH TEHSIL. KANTH DISTT. KANTH,9756799107,MAGHPURI INAYATPURI,MORADABAD,UTTAR PRADESH
PRTH0014132,Prathama Bank,PRTH0014132,,NEKPUR,P.O. SAGHAN MACHERIA (VIA JOYA) TEHSIL-SAMBHAL DISTT. MORADABD,9756799132,NEKPUR,MORADABAD,UTTAR PRADESH
PRTH0014145,Prathama Bank,PRTH0014145,,MANAUTA,P.O. MANAUTA TEHSIL-SAMBHAL DISTT. MORADABAD,9756799145,MANOTA,MORADABAD,UTTAR PRADESH
PRTH0014164,Prathama Bank,PRTH0014164,,KURI RAVANA,P.O. KURI RAWANA TEHSIL-KANTH DISTT.MORADABAD,9756799164,KURI RAWANA,MORADABAD,UTTAR PRADESH
PRTH0014177,Prathama Bank,PRTH0014177,,KANTH,"P.O. KANTH,DISTT:- MORADABAD",9756799177,KANTH,MORADABAD,UTTAR PRADESH
PRTH0014181,Prathama Bank,PRTH0014181,,SAMADPUR,"VILL. SAMADPUR, POST SADARPUR, MATLABPUR, TEHSIL KANTH,DISTT,.MORADABAD",9756799181,MORADABAD,MORADABAD,UTTAR PRADESH
PRTH0014212,Prathama Bank,PRTH0014212,,SHAHBAJPUR KALAN,"VILL & POST SHAHBAZPUR KALAN, TEHSIL-SAMBHAL,DISTT-MORADABAD,",8057911212,MORADABAD,MORADABAD,UTTAR PRADESH
PRTH0014221,Prathama Bank,PRTH0014221,,GUMSANI,"VILL. & POST GUMSANI,BLOCK ASMOLI, TEHSIL SAMBHAL, DISTT-J.P.NAGAR,PIN-244255,(U.P)",8449710221,MORADABAD,MORADABAD,UTTAR PRADESH
PRTH0016000,Prathama Bank,PRTH0016000,,RO SAMBHAL,"PRATHAMA BANK RO, SAMBHAL, NEAR SANKAR COLLEGE, SAMBHAL",9837001684,SAMBHAL,MORADABAD,UTTAR PRADESH
PRTH0016003,Prathama Bank,PRTH0016003,,SIRSI,"MOH. SADAQ SARAI, P.O. SIRSI, TEH. SAMBHAL DISTT. MORADABAD.",05923223235,SIRSI,MORADABAD,UTTAR PRADESH
PRTH0016004,Prathama Bank,PRTH0016004,,PAWANSA,"VILL. PAWANSA, P.O. PAWANSA, TEH.SAMBHAL, DISTT. MORADABAD.",05923229345,PANWASA,MORADABAD,UTTAR PRADESH
PRTH0016014,Prathama Bank,PRTH0016014,,SARAITAREEN,P.O. SARAI TAREEN P.O. SAMBHAL DISTT. MORADABAD.,05923272152,SARAI TARIN,MORADABAD,UTTAR PRADESH
PRTH0016019,Prathama Bank,PRTH0016019,,ASMOLI,P.O. ASMOLI TEH.SAMBHAL DISTT. MORADABAD.,05923221400,ASMOLI,MORADABAD,UTTAR PRADESH
PRTH0016027,Prathama Bank,PRTH0016027,,GUMTHAL,"BAHJOI ROAD, CHANDAUSI , TEHSIL CHANDAUSI DISTT. MORADABAD",05921256675,GUMTHAL,MORADABAD,UTTAR PRADESH
PRTH0016028,Prathama Bank,PRTH0016028,,DEENGARPUR,"P.O. DINGERPUR TEHSIL BILARI, DISTT. MORADABAD",05921248386,DINGARPUR,MORADABAD,UTTAR PRADESH
PRTH0016031,Prathama Bank,PRTH0016031,,KAITHAL,P.O. KAITHAL TEHSIL CHANDAUSI DISTT. MORADABAD,05921255862,KAITHAL,MORADABAD,UTTAR PRADESH
PRTH0016032,Prathama Bank,PRTH0016032,,MANJHOLA RAJA KA,P.O. MAJHOLA RAJA KA TEHSIL CHANDAUSI DISTT. MORADABAD,05921226582,MORADABAD,MORADABAD,UTTAR PRADESH
PRTH0016033,Prathama Bank,PRTH0016033,,PATHAKPUR,P.O. PATHAKPUR TEHSIL CHANDAUSI DISTT. MORADABAD,05921249100,PATHAKPUR,MORADABAD,UTTAR PRADESH
PRTH0016035,Prathama Bank,PRTH0016035,,SINGPUR SAINI,P.O. SINGHPUR SANI TEHSIL SAMBHAL DISTT. MORADABAD,05923222526,SINGPUR SANI,MORADABAD,UTTAR PRADESH
PRTH0016041,Prathama Bank,PRTH0016041,,MOHDPUR TANDA,"P.O. MOHDPUR TANDA, TEHSIL SAMBHAL  DISTT. MORADABAD",05921246342,MOHAMMADPUR TANDA,MORADABAD,UTTAR PRADESH
PRTH0016049,Prathama Bank,PRTH0016049,,LAKHORI JALALPUR,P.O. LAKHORI JALALPUR TEHSIL.SAMBHAL DISTT. MORADABAD,9927030665,LAKHORI,MORADABAD,UTTAR PRADESH
PRTH0016053,Prathama Bank,PRTH0016053,,BHAWANIPUR,P.O. BHAWANIPUR TEHSIL.SAMBHAL DISTT. MORADABAD,9927030564,BHAWANIPUR,MORADABAD,UTTAR PRADESH
PRTH0016056,Prathama Bank,PRTH0016056,,BANIAKHERA,P.O. BANIAKHERA TEHSIL.CHANDAUSI DISTT. MORADABAD,9756799056,BANIYA KHERA,MORADABAD,UTTAR PRADESH
PRTH0016062,Prathama Bank,PRTH0016062,,MAUKATHER,P.O. MAUKATHER TEHSIL. CHANDAUSI DISTT. MORADABAD,9756799062,MOUKATHER,MORADABAD,UTTAR PRADESH
PRTH0016064,Prathama Bank,PRTH0016064,,MAINATHER,P.O. MAINATHER  TEHSIL.BILARI DISTT. MORADABAD,9756799064,MANATHER,MORADABAD,UTTAR PRADESH
PRTH0016074,Prathama Bank,PRTH0016074,,JANETA,P.O. JANETA TEHSIL.CHANDAUSI DISTT. MORDABAD,9756799074,JANETA,MORADABAD,UTTAR PRADESH
PRTH0016075,Prathama Bank,PRTH0016075,,DAROLI AFZALPUR,P.O. –DAROLI AFZALPUR VIA NAROLI TEHSIL.CHANDAUSI DISTT.MORADABAD,9756799075,DAROLI AFZALPUR,MORADABAD,UTTAR PRADESH
PRTH0016083,Prathama Bank,PRTH0016083,202843102,CHANDAUSI,"P.O. & TEHSIL. CHANDAUSI, DISTT. MORADABAD",9756799083,CHANDAUSI,MORADABAD,UTTAR PRADESH
PRTH0016084,Prathama Bank,PRTH0016084,,AMARPUR KASHI,"P.O. AMARPUR KASHI TEHSIL, BILARI DISTT. MORDABAD",9756799084,AMARPUR KASHI,MORADABAD,UTTAR PRADESH
PRTH0016087,Prathama Bank,PRTH0016087,,SAUDHAN MOHAMMADPUR,"P.O. SODHAN MOHD.PUR TEHSIL- SAMBHAL, DISTT. MORADABAD",9756799087,SAUDHAN MOHD PUR,MORADABAD,UTTAR PRADESH
PRTH0016088,Prathama Bank,PRTH0016088,244843602,SAMBHAL,"NEAR ROADWAYS BUS STAND P.O. SAMBHAL, TEHSIL. SAMBHAL  DISTT. MORADABAD",9756799088,SAMBHAL,MORADABAD,UTTAR PRADESH
PRTH0016101,Prathama Bank,PRTH0016101,,BERNI,"P.O. BERNI, TEHSIL- CHANDAUSI DISTT. MORADABAD",9756799101,BERNI,MORADABAD,UTTAR PRADESH
PRTH0016111,Prathama Bank,PRTH0016111,,MOHDPUR WABAI,P.O. M.P. WABAI TEHSIL. CHANDAUSI DISTT. MORADABD,9756799111,MAHOMMADPUR WABAI,MORADABAD,UTTAR PRADESH
PRTH0016112,Prathama Bank,PRTH0016112,,KHIRNI MOINUDDINPUR,P.O. AMAWATI KUTUBPUR TEHSIL. SAMBHAL DISTT. MORADABAD,9756799112,KHIRNI MAHUIDDINPUR,MORADABAD,UTTAR PRADESH
PRTH0016113,Prathama Bank,PRTH0016113,,RAMPUR URF YARPUR,"P.O. RAMPUR URF YARPUR,TEHSIL. SAMBHAL DISTT. MORADABAD",9756799113,RAMPUR URF YARPUR,MORADABAD,UTTAR PRADESH
PRTH0016123,Prathama Bank,PRTH0016123,,MADALA FATEHPUR,P.O. ASMOLI TEH. SAMBHAL DISTT. MORADABAD,9756799123,FATEHPUR MADALA,MORADABAD,UTTAR PRADESH
PRTH0016167,Prathama Bank,PRTH0016167,,NARAULI,"MAIN MARKET, TEHSIL- CHANDAUSI DISTT. MORDABAD",9756799167,NARAULI,MORADABAD,UTTAR PRADESH
PRTH0016178,Prathama Bank,PRTH0016178,,BEHJOI,"TEHSIL SAMBHAL,DISTT: MORADABAD.",9756799178,BAHJOI,MORADABAD,UTTAR PRADESH
PRTH0016194,Prathama Bank,PRTH0016194,,ASALATPUR JARAI,"POST OFFICE:ASALATPUR JARAI,TEHSIL CHANDAUSI, DISTT: MORADABAD",9756799194,MORADABAD,MORADABAD,UTTAR PRADESH
PRTH0016210,Prathama Bank,PRTH0016210,,MEHMOODPUR MAFI,"VILL-MEHMOODPUR MAFI,POST.-SIRSI,TEHSIL-BILARI,DISTT-MORADABAD, ",8057911210,MORADABAD,MORADABAD,UTTAR PRADESH
PRTH0016224,Prathama Bank,PRTH0016224,,KHAGUPURA,"VILL.KHABUPURA,P.O.SAMBHAL,BHEEM NAGAR",8449710224,MORADABAD,MORADABAD,UTTAR PRADESH
PRTH0016227,Prathama Bank,PRTH0016227,,PATHARA,"VILL. PATHARA P.O. MAI,TEHSIL-CHANDAUSI, DISTT-BHEEM NAGAR",8449710227,MORADABAD,MORADABAD,UTTAR PRADESH
PRTH0016228,Prathama Bank,PRTH0016228,,NOORAI SARAI,"VILL. NOORAI SARAI P.O.MEERIYASARAI,TEHSEEL SAMBHAL,BHEEM NAGAR",8449710228,MORADABAD,MORADABAD,UTTAR PRADESH
PRTH0016229,Prathama Bank,PRTH0016229,,TANDA KOTHI,"VILL. TANDA KOTHI P.O.KHASPUR,TEHSEEL SAMBHAL,BHEEM NAGAR",8449710229,MORADABAD,MORADABAD,UTTAR PRADESH
PRTH0016238,Prathama Bank,PRTH0016238,,BABINA,"VILL. BABINA,P.O.MOHARA RATUPURA,BHEEM NAGAR",8476010238,MORADABAD,MORADABAD,UTTAR PRADESH
PRTH0016240,Prathama Bank,PRTH0016240,,JATPURA,"VILL.JATPURA,P.O.FATEHPUR KHAS,TEHSEEL BILARI,MORADABAD",8476010240,MORADABAD,MORADABAD,UTTAR PRADESH
PRTH0021163,Prathama Bank,PRTH0021163,,SARAWA,"P.O. SAID NAGAR ,TEHSIL-RAMPUR,DISTT- RAMPUR",9756799163,SARAVA,RAMPUR,UTTAR PRADESH
PRTH0022000,Prathama Bank,PRTH0022000,,RO RAMPUR,"PRATHAMA BANK RO, NAVIN MARKET, RAJDWARA ROAD, RAMPUR",9837001683,RAMPUR,RAMPUR,UTTAR PRADESH
PRTH0022090,Prathama Bank,PRTH0022090,244843102,RAMPUR MAIN,"P.O. MESTON GUNJ, RAMPUR,TEHSIL-SADAR,DISTT-RAMPUR",9756799090,RAMPUR,RAMPUR,UTTAR PRADESH
PRTH0022091,Prathama Bank,PRTH0022091,,BARAGAON,"P.O.BARAGAON,TEHSIL-SHAHABAD,DISTT- RAMPUR PIN-244922",9756799091,BADA GAON,RAMPUR,UTTAR PRADESH
PRTH0022092,Prathama Bank,PRTH0022092,,REWARI KALAN,"P.O. REWARI KALAN,TEHSIL-SHAHBAD,DISTT- RAMPUR PIN-244922",9756799092,REWARHI KALAN,RAMPUR,UTTAR PRADESH
PRTH0022093,Prathama Bank,PRTH0022093,,PUSHWARA,"P.O. SWAR,TEHSIL-SWAR,DISTT- RAMPUR PIN-244924",9756799093,PUSHWADA,RAMPUR,UTTAR PRADESH
PRTH0022094,Prathama Bank,PRTH0022094,,ANWARIE,"P.O.ANWARIA,TEHSIL-BILASPUR,DISTT- RAMPUR PIN-244921",9756799094,ANWARIA,RAMPUR,UTTAR PRADESH
PRTH0022095,Prathama Bank,PRTH0022095,,SALAI BARA GAON,"P.O. MILAK,TEHSIL-MILAK,DISTT- RAMPUR PIN-243701",9756799095,SALAI BADAGAON,RAMPUR,UTTAR PRADESH
PRTH0022096,Prathama Bank,PRTH0022096,,MANPUR OJHA,"P.O. MANPUR OJHA,TEHSIL-BILASPUR,DISTT- RAMPUR PIN-244921",9756799096,MANPUR OJHA,RAMPUR,UTTAR PRADESH
PRTH0022097,Prathama Bank,PRTH0022097,,MEERPUR MEERAGUNJ,"P.O. SWAR,TEHSIL-SWAR,DISTT- RAMPUR PIN-244924",9756799097,MEERAPUR MEER GANJ,RAMPUR,UTTAR PRADESH
PRTH0022098,Prathama Bank,PRTH0022098,,BARAKHAS,"P.O. BARA KHAS,TEHSIL-MILAK,DISTT- RAMPUR PIN-244901",9756799098,BARA KHAS,RAMPUR,UTTAR PRADESH
PRTH0022099,Prathama Bank,PRTH0022099,,KOILA,"P.O. KOILA ,TEHSIL-SADAR,DISTT- RAMPUR PIN-244901",9756799099,KOILA,RAMPUR,UTTAR PRADESH
PRTH0022114,Prathama Bank,PRTH0022114,,SAMODIA,"P.O. SWAR,TEHSIL-SWAR,DISTT- RAMPUR PIN-244924",9756799114,SAMODIA,RAMPUR,UTTAR PRADESH
PRTH0022117,Prathama Bank,PRTH0022117,,PARAM,"P.O. PARAM,TEHSIL MILAK,DISTT- RAMPUR PIN-243701",9756799117,PARAM,RAMPUR,UTTAR PRADESH
PRTH0022118,Prathama Bank,PRTH0022118,,MUBARAKPUR,"P.O. NIPNIYA,TEHSIL MILAK,DISTT- RAMPUR PIN-243701",9756799118,MUBARAKPUR,RAMPUR,UTTAR PRADESH
PRTH0022124,Prathama Bank,PRTH0022124,,DHANIAPUR SHANKARPUR,"P.O. DHAMORA,TEHSIL –SADAR,DISTT-RAMPUR PIN-244901",9756799124,DANIYAPUR SHANKERPUR,RAMPUR,UTTAR PRADESH
PRTH0022125,Prathama Bank,PRTH0022125,,AJEETPUR,"P.O. AJEETPUR,TEHSIL-SADAR,DISTT- RAMPUR PIN-244901",9756799125,AJEETPUR,RAMPUR,UTTAR PRADESH
PRTH0022126,Prathama Bank,PRTH0022126,,BAKENIA,"P.O. BAKENIA,TEHSIL-RAMPUR,DISTT- RAMPUR PIN-244901",9756799126,BAKENIA,RAMPUR,UTTAR PRADESH
PRTH0022127,Prathama Bank,PRTH0022127,,AJEEM NAGAR,"P.O. AZEEM NAGAR,TEHSILSADAR,DISTT- RAMPUR PIN-244901",9756799127,AZEEM NAGAR,RAMPUR,UTTAR PRADESH
PRTH0022128,Prathama Bank,PRTH0022128,,RAZA NAGAR,"P.O. SWAR,TEHSIL-SWAR,DISTT- RAMPUR PIN-244924",9756799128,RAZA NAGAR,RAMPUR,UTTAR PRADESH
PRTH0022131,Prathama Bank,PRTH0022131,,PATTIBASANTPUR,"P.O. PATTI BASANTPUR,TEHSIL-MILAK,DISTT- RAMPUR PIN-243701",9756799131,PATTI BASANTPUR,RAMPUR,UTTAR PRADESH
PRTH0022134,Prathama Bank,PRTH0022134,,MILAK,"P.O. MILAK ,TEHSIL-DISTT- RAMPUR PIN-244901",9756799134,MILAK,RAMPUR,UTTAR PRADESH
PRTH0022137,Prathama Bank,PRTH0022137,244843702,BILASPUR,"P.O. BILASPUR,TEHSIL-BILASPUR,DISTT- RAMPUR PIN-244921",9756799137,BILASPUR,RAMPUR,UTTAR PRADESH
PRTH0022139,Prathama Bank,PRTH0022139,,SEVIA KALAN,"P.O. MATHURAPUR KHURD,TEHSIL-SHAHBAD,DISTT- RAMPUR",9756799139,RAMPUR,RAMPUR,UTTAR PRADESH
PRTH0022150,Prathama Bank,PRTH0022150,,SWAR,"P.O. SWAR,TEHSIL-SWAR,DISTT- RAMPUR PIN-244924        ",9756799150,SUAR,RAMPUR,UTTAR PRADESH
PRTH0022151,Prathama Bank,PRTH0022151,,NAYA SAGARPUR,"P.O. NAYA SAGARPUR,TEHSIL-SHAHBAD,DISTT- RAMPUR PIN-202411",9756799151,NAYA SAGAR PUR,RAMPUR,UTTAR PRADESH
PRTH0022152,Prathama Bank,PRTH0022152,,SHAHBAD,"P.O. SHAHBAD,TEHSIL-SHAHBAD,DISTT- RAMPUR PIN-244922",9756799152,SHAHABAD,RAMPUR,UTTAR PRADESH
PRTH0022153,Prathama Bank,PRTH0022153,,MADHUKAR,"P.O. MADHUKAR,TEHSIL-SHAHBAD,DISTT- RAMPUR PIN-244922",9756799153,MADHUKAR,RAMPUR,UTTAR PRADESH
PRTH0022155,Prathama Bank,PRTH0022155,,PUNJAB NAGAR,"P.O. MULLA KHERA TEHSIL-BILASPUR,DISTT- RAMPUR PIN-244921",9756799155,PUNJAB NAGAR(BILASPUR),RAMPUR,UTTAR PRADESH
PRTH0022156,Prathama Bank,PRTH0022156,,SIMARIA,"VILL. & POST-SIMARIA ,TEHSIL-MILAK ,DISTT- RAMPUR PIN-243701",9756799156,SIMARIA,RAMPUR,UTTAR PRADESH
PRTH0022157,Prathama Bank,PRTH0022157,,RAS DANDIA,"P.O. RASS DANDIYA,TEHSIL-MILAK ,DISTT- RAMPUR PIN- 244921",9756799157,RAS DANDIYA,RAMPUR,UTTAR PRADESH
PRTH0022158,Prathama Bank,PRTH0022158,,LOHAPATTI,"P.O. LOHAPATTI ,TEHSIL-MILAK,DISTT- RAMPUR PIN-244901",9756799158,LOHA PATTI,RAMPUR,UTTAR PRADESH
PRTH0022161,Prathama Bank,PRTH0022161,,NARKHEDA,"P.O. NARKHERA TEHSIL-BILASPUR,DISTT- RAMPUR PIN-244921",9756799161,NARKHERA,RAMPUR,UTTAR PRADESH
PRTH0022166,Prathama Bank,PRTH0022166,,KEMRI,"V-KEMRI BILASPUR RAOD,TEHSIL-BILASPUR,DISTT RAMPUR PIN244921",9756799166,KEMRI,RAMPUR,UTTAR PRADESH
PRTH0022180,Prathama Bank,PRTH0022180,,DHANORA,"VILL DHAMORA ,TEHSIL  MILAK,DISTT: RAMPUR",9756799180,RAMPUR,RAMPUR,UTTAR PRADESH
PRTH0022183,Prathama Bank,PRTH0022183,,PANWARIA,"BAREILLY ROAD, PANWARIA RAMPUR,TEHSIL RAMPUT, DISTT. RAMPUR",9756799183,RAMPUR,RAMPUR,UTTAR PRADESH
PRTH0022184,Prathama Bank,PRTH0022184,,MASWASI,"HOLI CHAURAHA, KASHIPUR ROAD, MASVASI, TEHSIL SWAR, DISTT. RAMPUR",9756799184,MASWASI,RAMPUR,UTTAR PRADESH
PRTH0022195,Prathama Bank,PRTH0022195,,BHOT,"VILL & P.O.BHOT,TEH:RAMPUR,DISTT:RAMPUR PIN-244901",9756799195,BHOT,RAMPUR,UTTAR PRADESH
PRTH0022196,Prathama Bank,PRTH0022196,,MILAK KHANAM,"VILL. MILAK KHANAM,POST OFFICE:MILAK KHANAM,TEH:SWAR,DISTT:RAMPUR PIN-244921",9756799196,RAMPUR,RAMPUR,UTTAR PRADESH
PRTH0022197,Prathama Bank,PRTH0022197,,SAIFNI,"VILL & P.O. SAIFNI,TEH:SHAHBADDISTT: RAMPUR PIN-202407",9756799197,SAIFNI,RAMPUR,UTTAR PRADESH
PRTH0022209,Prathama Bank,PRTH0022209,,DIBDIBA,"VILL DIBDIBA,POST-BILASPUR,TEHSIL-BILASPUR,DISTT-RAMPUR, PIN-244923(U.P)",8057911209,RAMPUR,RAMPUR,UTTAR PRADESH
PRTH0022219,Prathama Bank,PRTH0022219,,GANGAPUR KHADEEM,"VILL.GANGAPUR KHADEEM,POST SIMARIA TESHIL MILAK,DISTT-RAMPUR",8449710219,RAMPUR,RAMPUR,UTTAR PRADESH
PRTH0022225,Prathama Bank,PRTH0022225,,HAMEERPUR,"VILL & POST HAMEERPUR,TEHSIL THANDA,DISTT-RAMPUR",8449710225,RAMPUR,RAMPUR,UTTAR PRADESH
PRTH0022226,Prathama Bank,PRTH0022226,,AGAPUR,"VILL. & POST AGAPUR, TEHSIL SADAR,DISTT-RAMPUR",8449710226,RAMPUR,RAMPUR,UTTAR PRADESH
PRTH0022239,Prathama Bank,PRTH0022239,,NARPAT NAGAR,"VILL NARPAT NAGAR,POST-POONDAWALA,RAMPUR",8476010239,RAMPUR,RAMPUR,UTTAR PRADESH
PRTH0023115,Prathama Bank,PRTH0023115,,PEEPLI NAYAK,"P.O. PEEPLINAYAK VIA TANDA,TEHSIL-SWAR,DISTT- RAMPUR",9756799115,PEEPLI NAYAK,RAMPUR,UTTAR PRADESH
