ID,BANK,IFSC_CODE,MICR_CODE,BRANCH_NAME,ADDRESS,CONTACT,CITY,DISTRICT,STATE
CSBK0000173,Catholic Syrian Bank,CSBK0000173,NON-MICR,MULLURKARA,"DOOR NO. V/36A, MULLURKARA - 680583, THRISSUR DISTRICT",TRISSUR,,,KERALA
CSBK0000174,Catholic Syrian Bank,CSBK0000174,695047007,MANNATHALA,"RAJEEVAM SHOPPING COMPLEX, UP XIV/716, MANNANTHALA PO, THIRUVANANTHAPURAM - 695015",TRIVANDRUM,,,KERALA
CSBK0000175,Catholic Syrian Bank,CSBK0000175,NON-MICR,DINDIGUL,"NO. 27, NISHA COMPLEX PALANI ROAD DINDIGUL - 624 001",DINDIGUL,,,TAMIL NADU
CSBK0000176,Catholic Syrian Bank,CSBK0000176,685047002,THODUPUZHA,"JYOTHI SUPER BAZAR, THODUPUZHA, IDUKKI DISTRICT",IDUKKI,,,KERALA
CSBK0000177,Catholic Syrian Bank,CSBK0000177,400047002,MUMBAI FORT,"MARSHALL BLDG ANNEX,SOORJI VALLABHDAS MARG, BALLARD ESTATE,MUMBAI - 400 038, MAHARASHTRA",GREATER MUMBAI,,,MAHARASHTRA
CSBK0000178,Catholic Syrian Bank,CSBK0000178,NON-MICR,VAIKOM,"VII/350, 1ST FLOOR, HOSPITAL ROAD VAIKOM KOTTAYAM DT KERALA - 686 141",KOTTAYAM,,,KERALA
CSBK0000179,Catholic Syrian Bank,CSBK0000179,695047009,KAZHAKUTTOM,"PLACKAL TOWER, KP 2/876, NH BYE PASS, PO. KAZHAKUTTOM, THIRUVANANTHAPURAM - 695582",TRIVANDRUM,,,KERALA
CSBK0000180,Catholic Syrian Bank,CSBK0000180,NON-MICR,MAVELIKARA,"THAYYIL SHOPPING COMPLEX, 1ST FLOOR, AVJ JUNCTION., MAVELIKARA - 690101 ALAPPUZHA DT., KERALA",ALAPUZZHA,,,KERALA
CSBK0000181,Catholic Syrian Bank,CSBK0000181,NON-MICR,KOOVAPALLY,"NARAYANA BUILDING KOOVAPALLY-686518 KOTTAYAM DT., KERALA",KOTTAYAM,,,KERALA
CSBK0000182,Catholic Syrian Bank,CSBK0000182,NON-MICR,NALUKODY,"VALUPARAMBIL BUILDING,NALUKODY-686548,KOTTAYAM DT,KERALA.",KOTTAYAM,,,KERALA
CSBK0000183,Catholic Syrian Bank,CSBK0000183,NON-MICR,TUTICORIN,"MANUEL TOWERS, 52/B EAST CAR STREET, TUTICORIN-628002 TAMIL NADU",THOOTHKUDI,,,TAMIL NADU
CSBK0000184,Catholic Syrian Bank,CSBK0000184,NON-MICR,TIRUPATTUR,"38-A, SUNDER LODGE BUILDING,GROUND FLOOR KRISHNAGIRI ROAD, TIRUPATTUR - 635601 NORTH ARCOT DT., TAMIL NADU",VELLORE,,,TAMIL NADU
CSBK0000185,Catholic Syrian Bank,CSBK0000185,680047003,M O ROAD THRISSUR,"DOOR NO. XXV/46, P.B. NO. 132, M.O. ROAD, THRISSUR - 680001, KERALA",TRISSUR,,,KERALA
CSBK0000186,Catholic Syrian Bank,CSBK0000186,682047005,GIRINAGAR,"DOOR NO. XXX/IV, GCDA BUILDING, GIRINAGAR NORTH ,COCHI,682020",ERNAKULAM,,,KERALA
CSBK0000187,Catholic Syrian Bank,CSBK0000187,NON-MICR,VADAKARA,"P.B.NO.1, CHORODE 673106, BADAGARA, KOZHIKODE DT., KERALA",KOZHIKODE,,,KERALA
CSBK0000188,Catholic Syrian Bank,CSBK0000188,NON-MICR,THIKKOTI,"ROSE TOWERS, MAIN ROAD, THIKKOTI - 673529",KOZHIKODE,,,KERALA
CSBK0000189,Catholic Syrian Bank,CSBK0000189,NON-MICR,KOMBODINJAMAKKAL,"RAJ COMPLEX, KOMBODINJAMAKKAL, P.O. THAZHEKAD - 680697",TRISSUR,,,KERALA
CSBK0000190,Catholic Syrian Bank,CSBK0000190,NON-MICR,PRAVUMKOOD,"PALLATH MADAM BUILDINGS PRAVUMKOOD JN., MAZHUKEER,P.O.KALLISSERY PIN-689124, ALAPPUZHA DT., KERALA",ALAPUZZHA,,,KERALA
CSBK0000191,Catholic Syrian Bank,CSBK0000191,NON-MICR,MALAKKARA,"VIA, EDAYARANMULA,MALAKKARA-689 532,PATHANAMTHITTA DIST, KERALA",PATHANAMTHITTA,,,KERALA
CSBK0000192,Catholic Syrian Bank,CSBK0000192,NON-MICR,THATTAYIL,"K.S.JACOB BUILDING P.O.THATTAYIL - 691525 PATHANAMTHITTA DT., KERALA",PATHANAMTHITTA,,,KERALA
CSBK0000193,Catholic Syrian Bank,CSBK0000193,NON-MICR,VANNAPURAM,"VIA THODUPUZHA VANNAPPURAM-685582, THOPPIL BUILDING, IDUKKI DT., KERALA",IDUKKI,,,KERALA
CSBK0000194,Catholic Syrian Bank,CSBK0000194,NON-MICR,ANTHIKAD,"P.O. ANTHIKAD, ANTHIKAD - 680641, THRISSUR DISTRICT",TRISSUR,,,KERALA
CSBK0000195,Catholic Syrian Bank,CSBK0000195,NON-MICR,PANAMARATHUPATTI,"SANJEEVI COMPLEX, CHANDAPETTAI, PANAMARATHUPATTI-636204, SALEM DT.",SALEM,,,TAMIL NADU
CSBK0000196,Catholic Syrian Bank,CSBK0000196,NON-MICR,AMMAPALAYAM,"MAIN ROAD, AMMAPALAYAM-621 101 PERAMBALUR DT., TAMIL NADU",PERAMBALUR,,,TAMIL NADU
CSBK0000197,Catholic Syrian Bank,CSBK0000197,NON-MICR,NATTIKA,"P.B. NO. 13, THRIPRAYAR JUNCTION, P.O. NATTIKA, THRISSUR - 680566, KERALA",TRISSUR,,,KERALA
CSBK0000198,Catholic Syrian Bank,CSBK0000198,600047003,KODAMBAKKAM,"49,GOKULAM BLDG,ARCOT ROAD,KODAMBAKKOM-600 024",CHENNAI,,,TAMIL NADU
CSBK0000199,Catholic Syrian Bank,CSBK0000199,NON-MICR,VELLAR,"5/90, DHARMAPURI MAIN ROAD KOVIL, VELLAR-636451 SALEM DT., TAMIL NADU",SALEM,,,TAMIL NADU
CSBK0000200,Catholic Syrian Bank,CSBK0000200,NON-MICR,VELLORE,"80/2 , IDA SCUDDER ROAD , OPP CMS , VELLORE 632004",VELLORE,,,TAMIL NADU
CSBK0000201,Catholic Syrian Bank,CSBK0000201,500047002,HYDERABAD,"D/NO.5-9-241-244,FIRST FLOOR , OPP. GRAMMAR SCHOOL,ABID ROAD,HYDERABAD - 500 001",HYDERABAD URBAN,,,ANDHRA PRADESH
CSBK0000202,Catholic Syrian Bank,CSBK0000202,NON-MICR,MAKKARAPARAMBA,"P.B.NO.2, MAIN ROAD, MAKKARAPARAMBA - 676507 MALAPPURAM DT., KERALA",MALAPURAM,,,KERALA
CSBK0000203,Catholic Syrian Bank,CSBK0000203,NON-MICR,BELGAUM,"ISHANOPUS,IST FLR,P.B.NO 533,CONGRESS RD,TILAKWADI,BELGAUM,590006",BELGAUM,,,KARNATAKA
CSBK0000204,Catholic Syrian Bank,CSBK0000204,NON-MICR,MYSORE,"PB NO 5, SILVER TOWER, D.NO 9/2, OPP CLOCK TOWER, ASHOKA ROAD, MYSORE - 570001",MYSORE,,,KARNATAKA
CSBK0000205,Catholic Syrian Bank,CSBK0000205,110047002,CONNAUGHT CIRCUS NEWDELHI,"G-36 CONNAUGHT CIRCUS,NEW DELHI - 110 001, NEW DELHI",NEW DELHI,,,DELHI
CSBK0000206,Catholic Syrian Bank,CSBK0000206,520047001,VIJAYAWADA,"USHA ESTATES, DOOR NO 27.13.28, GOPALAREDDY ROAD, GOVERNPOST, VIJAYAWADA - 520002",KRISHNA,,,ANDHRA PRADESH
CSBK0000207,Catholic Syrian Bank,CSBK0000207,520047102,GUNTUR,"MAIN ROAD, ARUNDALPET, GUNTUR - 522002",GUNTUR,,,ANDHRA PRADESH
CSBK0000208,Catholic Syrian Bank,CSBK0000208,560047004,BANGALORE CITY,"FIRST MAIN ROAD, GANDHI NAGAR, BANGALORE CITY - 560009",BANGALORE URBAN,,,KARNATAKA
CSBK0000209,Catholic Syrian Bank,CSBK0000209,641047102,TIRUPUR,"SEETHA ARCADE , KUMARAN ROAD , TIRUPUR , COIMBATORE 641601",COIMBOTORE,,,TAMIL NADU
CSBK0000210,Catholic Syrian Bank,CSBK0000210,NON-MICR,NELLORE,"PB NO 3, SUBEDARPET ROAD, NELLORE - 524001, ANDHRA PRADESH",NELLORE,,,ANDHRA PRADESH
CSBK0000211,Catholic Syrian Bank,CSBK0000211,700047002,LAL BAZAR KOLKATA,"FIRST FLOOR, PODDAR COURT, 18, RABINDRA SARANI, KOLKATA 700001",KOLKATA,,,WEST BENGAL
CSBK0000212,Catholic Syrian Bank,CSBK0000212,NON-MICR,THANJAVUR,"104,ESAT MAIN STREET ,THANJAVUR , TAMILNADU PIN 613001",THANJAVUR,,,TAMIL NADU
CSBK0000213,Catholic Syrian Bank,CSBK0000213,580047002,HUBLI,"FIRST FLOOR LAKSHMI - BALAKRISHNA SQUARE STATION ROAD DHARWAD DT. HUBLI, KARNATAKA- 580 020",DHARWAD,,,KARNATAKA
CSBK0000214,Catholic Syrian Bank,CSBK0000214,NON-MICR,THEKKADA,"THEKKADA P.O.VEMBAYAM - 695615 THIRUVANATHAPURAM DT., KERALA",TRIVANDRUM,,,KERALA
CSBK0000215,Catholic Syrian Bank,CSBK0000215,NON-MICR,VALLICODE,"VAYANASALA JUNCTION, P.O.VALLICODE PIN-689659, PATHANAMTHITTA DT., KERALA",PATHANAMTHITTA,,,KERALA
CSBK0000216,Catholic Syrian Bank,CSBK0000216,NON-MICR,R.V.P.PUDUR,"5/432, MAIN ROAD, P.O. R.V.P PUDUR, PIN- 678555 PALAKKAD DT., KERALA",PALAKKAD,,,KERALA
CSBK0000217,Catholic Syrian Bank,CSBK0000217,NON-MICR,KANAKKARY,"K.P.W.10,KANAKKARY P O,KOTTAYAM DT,686632",KOTTAYAM,,,KERALA
CSBK0000218,Catholic Syrian Bank,CSBK0000218,600047005,ROYAPETTAH,"NO.18,V.S.S.M BUILDING,ROYAPETTAH ROAD,CHENNAI - 600 014",CHENNAI,,,TAMIL NADU
CSBK0000219,Catholic Syrian Bank,CSBK0000219,NON-MICR,BHIMAVARAM,"PB NO 57, P.P ROAD, 22/2/23, PRAKASAM CHOWK, BHIMAVARAM - 534201, WEST GODAVARI DT, ANDHRA PRADESH",WEST GODAVARI,,,ANDHRA PRADESH
CSBK0000220,Catholic Syrian Bank,CSBK0000220,NON-MICR,CHENAPPADY,"P.O.CHENAPPADY VIA KANJIRAPALLY-686525 KOTTAYAM DT., KERALA",KOTTAYAM,,,KERALA
CSBK0000221,Catholic Syrian Bank,CSBK0000221,NON-MICR,RAJAMUNDRY,"PB NO 23, FIRST FLOOR, STADIUM ROAD, RAJAMUNDRY, EAST GODAVARY - 533101",EAST GODAVARI,,,ANDHRA PRADESH
CSBK0000222,Catholic Syrian Bank,CSBK0000222,575047002,MANGALORE,"I FLOOR, KUNIL CENTRE, DR. U P MALAYA ROAD,HAMPANKETTA, MANGALORE-575001",DAKSHINA KANNADA,,,KARNATAKA
CSBK0000223,Catholic Syrian Bank,CSBK0000223,600047006,MOUNT ROAD CHENNAI,"826,TARAPORE TOWERS,MOUNT ROAD,CHENNAI - 600 002",CHENNAI,,,TAMIL NADU
CSBK0000224,Catholic Syrian Bank,CSBK0000224,NON-MICR,MAMMIYOOR,"VAKKAYIL COMPLEX, MAMMIYOOR JUNCTION, P.O. GURUVAYUR, THRISSUR - 680101, KERALA",TRISSUR,,,KERALA
CSBK0000225,Catholic Syrian Bank,CSBK0000225,NON-MICR,AVANOOR,"II/248, AVANOOR - 680547, (VIA) MUNDUR, THRISSUR DISTRICT",TRISSUR,,,KERALA
CSBK0000226,Catholic Syrian Bank,CSBK0000226,NON-MICR,NELLAD,"PARAKKUDIYIL BUILDINGS, DOOR NO.726, P.O.NELLAD - 686721 ERNAKULAM DT., KERALA",ERNAKULAM,,,KERALA
CSBK0000227,Catholic Syrian Bank,CSBK0000227,680047004,"WEST FORT, THRISSUR","P.B. NO. 805, M.G. ROAD, WEST FORT, THRISSUR - 680004, KERALA",TRISSUR,,,KERALA
CSBK0000228,Catholic Syrian Bank,CSBK0000228,605047001,PONDICHERRY,DOOR NO. 474/476/478 M G ROAD PONDICHERRY - 605 001,PONDICHERRY,,,PONDICHERRY
CSBK0000229,Catholic Syrian Bank,CSBK0000229,NON-MICR,GULBARGA,"PLOT NO.7., SUPER MARKET, P.B. NO. 33, GULBARGA, KARNATAKA- 585 101",GULBERGA,,,KARNATAKA
CSBK0000230,Catholic Syrian Bank,CSBK0000230,411047001,PUNE,"FIRST STERLING CENTRE, OPP. HOTEL ARORA TOWER, M G ROAD, PUNE 411 01",GREATER MUMBAI,,,MAHARASHTRA
CSBK0000231,Catholic Syrian Bank,CSBK0000231,680047006,COLLEGE ROAD THRISSUR,"P.B. NO.502, ""COLLEGE VIEW"", HEAD OFFICE BUILDING, ST. MARY'S COLLEGE ROAD, THRISSUR - 680020, KERALA",TRISSUR,,,KERALA
CSBK0000232,Catholic Syrian Bank,CSBK0000232,600047001,SERVICE BR. CHENNAI,"826,TARAPORE TOWERS,MOUNT ROAD,CHENNAI - 600 002",CHENNAI,,,TAMIL NADU
CSBK0000233,Catholic Syrian Bank,CSBK0000233,400047004,MULUND,"ANU APARTMENTS, GOVARDHAN NAGAR,L B S MARG, MULUND WEST 400 082",GREATER MUMBAI,,,MAHARASHTRA
CSBK0000234,Catholic Syrian Bank,CSBK0000234,682047003,PALARIVATTOM,"MARKET ROAD, ERNAKULAM, KOCHI - 682011, ERNAKULAM, KERALA",ERNAKULAM,,,KERALA
CSBK0000235,Catholic Syrian Bank,CSBK0000235,695047006,KOWDIAR,"TEMPLE ROAD, AMBALAMUKKU JN , KOWDIAR , TRIVANDRUM - 695 003, KERALA",TRIVANDRUM,,,KERALA
CSBK0000237,Catholic Syrian Bank,CSBK0000237,680047000,THRISSUR NRI,"CSB BHAVAN', ST. MARY'S COLLEGE ROAD, THRISSUR - 680020",TRISSUR,,,KERALA
CSBK0000238,Catholic Syrian Bank,CSBK0000238,NON-MICR,KOTHAMANGALAM,"PILMA BUILDING, P.B.NO: 55, A.M ROAD, KOTHAMANGALAM, ERNAKULAM DT. -686691",ERNAKULAM,,,KERALA
CSBK0000239,Catholic Syrian Bank,CSBK0000239,390047002,BARODA,"AANGAN TOWER, OPP. BHAVANS SCHOOL, INDIRA GANDHI MARG, BARODA - 390004",GANDHINAGAR,,,GUJARAT
CSBK0000240,Catholic Syrian Bank,CSBK0000240,395047002,SURAT,"FIRST FLOOR,DEVANG SHOPPING CENTRE,NEAR PEARL POINT, SURAT-395 007",SURAT,,,GUJARAT
CSBK0000241,Catholic Syrian Bank,CSBK0000241,NON-MICR,SULTAN BATHERY,"PB NO.25, FIRST FLOOR, SUJANA COMPLEX, KALPETTA - MYSORE ROAD, SULTHAN BATHERY - 673592",WAYANAD,,,KERALA
CSBK0000242,Catholic Syrian Bank,CSBK0000242,NON-MICR,MANNARKKAD,"`DOOR NO. 7/191, 1ST FLOOR, NAWAR COMPLEX, HOSPITAL JUNCTION, MANNARKKAD-678582",PALAKKAD,,,KERALA
CSBK0000243,Catholic Syrian Bank,CSBK0000243,NON-MICR,TIRUVALLUR,"NO.50, MOTILAL STREET, THIRUVALLUR - 602001 TAMIL NADU",TIRUVALLUR,,,TAMIL NADU
CSBK0000244,Catholic Syrian Bank,CSBK0000244,600047007,PALLAVARAM,"7/IA, INDIRA GANDHI ROAD, PALLAVARAM, KANCHEEPURAM DT, CHENNAI - 600 043",KANCHEEPURAM,,,TAMIL NADU
CSBK0000245,Catholic Syrian Bank,CSBK0000245,560047005,YELEHANKA,"1217, OPP. SHOPPING COMPLEX, NEW TOWN, YELAHANKA, BANGALORE - 560064",BANGALORE URBAN,,,KARNATAKA
CSBK0000246,Catholic Syrian Bank,CSBK0000246,NON-MICR,RANNI,"PB NO 7,MULAMOOTTIL BLDG,RANNI,PAZHAVANGADI-689673",PATHANAMTHITTA,,,KERALA
CSBK0000247,Catholic Syrian Bank,CSBK0000247,682047004,KALOOR AZAD ROAD,"PAVAKULAM CHAMBERS 36/2289 B,AZAD ROAD,KALOOR,KOCHI,682017",ERNAKULAM,,,KERALA
CSBK0000248,Catholic Syrian Bank,CSBK0000248,NON-MICR,"T.K ROAD,THIRUVALLA","KUNNATHUPARAMBIL SHOPPING COMPLEX T K ROAD, THIRUVALLA - 689101 PATHANAMTHITTA DT., KERALA",PATHANAMTHITTA,,,KERALA
CSBK0000249,Catholic Syrian Bank,CSBK0000249,NON-MICR,KANJIRAPALLY,"TMC BUILDINGS,NEAR RUBBER BOARD REGIONAL OFFICE,KK ROAD,KANJIRAPALLY PO, KOTTAYAM DT.",KOTTAYAM,,,KERALA
CSBK0000250,Catholic Syrian Bank,CSBK0000250,NON-MICR,KUMBANAD,"LEEJOY BUILDINGS, IV/450, KOIPURAM PANCHAYAT,P.O.KUMBANAD-689547 PATHANAMTHITTA DT., KERALA",PATHANAMTHITTA,,,KERALA
CSBK0000251,Catholic Syrian Bank,CSBK0000251,673047005,"MAVOOR ROAD, KOZHIKODE","ALPHONSA BLDG.,MAVOOR RD.,KOZHIKODE 673004",KOZHIKODE,,,KERALA
CSBK0000252,Catholic Syrian Bank,CSBK0000252,682047016,KALAMASSERY,"FIRST FLOOR, RAINA COMPLEX, PREMIER JUNCTION, KALAMASSERY - 683104",ERNAKULAM,,,KERALA
CSBK0000253,Catholic Syrian Bank,CSBK0000253,NON-MICR,PANAJI GOA,"GROUND FLOOR,'HOTEL SUMMIT BLDG,MENEZEZ BRAGANZA RD,NEAR FIDALGO,PANAJI,403001",NORTH GOA,,,GOA
CSBK0000255,Catholic Syrian Bank,CSBK0000255,NON-MICR,VARKALA,"DOOR NO.XX 1/356, TEMPLE ROAD, VARKALA. THIRUVANANTHAPURAM DT., KERALA",TRIVANDRUM,,,KERALA
CSBK0000256,Catholic Syrian Bank,CSBK0000256,NON-MICR,KALPETTA,"KEERTHI BUILDING, MAIN ROAD, KALPETTA, WAYANAD - 673 121",WAYANAD,,,KERALA
CSBK0000257,Catholic Syrian Bank,CSBK0000257,NON-MICR,PERINTHALMANNA,"SASIDHARAN T K, PHONE: 04933-226477,EMAIL: PERINTHALMANNA@CSB.CO.IN",MALAPURAM,,,KERALA
CSBK0000258,Catholic Syrian Bank,CSBK0000258,NON-MICR,MUNNAR,"CARMEL CENTRE, G.H ROAD, MUNNAR - 685612, IDUKKI DT. KERALA",IDUKKI,,,KERALA
CSBK0000259,Catholic Syrian Bank,CSBK0000259,600047008,IFB-CHENNAI,"826,TARAPORE TOWERS,MOUNT ROAD,CHENNAI - 600 002",CHENNAI,,,TAMIL NADU
CSBK0000260,Catholic Syrian Bank,CSBK0000260,NON-MICR,KASARGOD,"K J JOSEPH, PHONE: 04994-222590,EMAIL: KASARGOD@CSB.CO.IN",KASARAGOD,,,KERALA
CSBK0000261,Catholic Syrian Bank,CSBK0000261,NON-MICR,BHAVANI,"SAMY COMPLEX, FIRST FLOOR, METTUR ROAD, NEAR NEW BUS STAND, BHAVANI-638302 ERODE DT., TAMILNADU",ERODE,,,TAMIL NADU
CSBK0000262,Catholic Syrian Bank,CSBK0000262,380047002,AHMEDABAD,"P B NO.11042, 1ST FLOOR, SAHAJANAND TRADE CENTRE,  ASHRAM ROAD, PREETAM NAGAR, PALDI, AHMEDABAD 380006",AHMEDABAD,,,GUJARAT
CSBK0000263,Catholic Syrian Bank,CSBK0000263,641047006,COIMBATORE-IFB,"DOOR NO. 493, WARD NO.43, CROSS CUT ROAD, P.B. NO. 2967, COIMBATORE, T N- 641 012",COIMBOTORE,,,TAMIL NADU
CSBK0000264,Catholic Syrian Bank,CSBK0000264,400047005,IFB-MUMBAI,"53, EAST AND WEST BUILDINGMUMBAI SAMACHAR MARG, OPP.MUMBAI STOCK EXCHANGE,FORT MUMBAI-400023, MAHARASHTRA",GREATER MUMBAI,,,MAHARASHTRA
CSBK0000265,Catholic Syrian Bank,CSBK0000265,NON-MICR,SIVAKASI,"33-33A, WEST CAR STREET, SIVAKASI,VIRUDHANAGAR DT., T N - 626 123",VIRUDHUNAGAR,,,TAMIL NADU
CSBK0000266,Catholic Syrian Bank,CSBK0000266,600047009,AMBATTUR,"358, M.T.H ROAD, AMBATTUR, CHENNAI - 600053",TIRUVALLUR,,,TAMIL NADU
CSBK0000267,Catholic Syrian Bank,CSBK0000267,NON-MICR,KANJIKODE,"PANNIVELIL BLDGS,OPP.ITI, KANJIKODE WEST - 678 623",PALAKKAD,,,KERALA
CSBK0000268,Catholic Syrian Bank,CSBK0000268,NON-MICR,KANHANGAD,"OPP.CITY HOSPITAL, NORTH KOTTACHERY, KANHANGAD-671315 KASARGOD DT., KERALA",KASARAGOD,,,KERALA
CSBK0000269,Catholic Syrian Bank,CSBK0000269,641047005,GANAPATHY,"KALPA BUILDING ,LAKSHMIPURAM ,GANAPATHY ,COIMBATORE PIN 641006",COIMBOTORE,,,TAMIL NADU
CSBK0000270,Catholic Syrian Bank,CSBK0000270,682047001,ERNAKULAM SER.BR,"DJM BUILDING, MARKET ROAD, ERNAKULAM.",ERNAKULAM,,,KERALA
CSBK0000271,Catholic Syrian Bank,CSBK0000271,NON-MICR,GOBICHETTIPALAYAM,"77,MAIN ROAD, NEAR BUS STAND GOBICHETTIPALAYAM-638476 TAMILNADU",ERODE,,,TAMIL NADU
CSBK0000272,Catholic Syrian Bank,CSBK0000272,NON-MICR,TIRURANGADI,"KAKKAD-CHEMMAD ROAD, OPP PSMO COLLEGE, TIRURANGADI-676306",MALAPURAM,,,KERALA
CSBK0000273,Catholic Syrian Bank,CSBK0000273,600047010,GUINDY,"DOOR NO.64, MOUNT ROAD, GUINDY, CHENNAI - 600032",CHENNAI,,,TAMIL NADU
CSBK0000274,Catholic Syrian Bank,CSBK0000274,NON-MICR,UDUMALPET,"45, FIRST FLOOR , DHALI ROAD,UDUMALPET 642126",COIMBOTORE,,,TAMIL NADU
CSBK0000275,Catholic Syrian Bank,CSBK0000275,680047009,ARANATTUKARA,"ST. THOMAS CHURCH SHOPPING COMPLEX, BIG BAZAR, ARANNATTUKARA, THRISSUR - 680618, KERALA",TRISSUR,,,KERALA
CSBK0000276,Catholic Syrian Bank,CSBK0000276,500047003,SECUNDERABAD,"1ST FLOOR,DIAMOND TOWERS, S D ROAD, DECUNDERABAD- 500003",HYDERABAD URBAN,,,ANDHRA PRADESH
CSBK0000277,Catholic Syrian Bank,CSBK0000277,400047006,VASHI,"NO. 20, DAFFODILS, SECTOR -14, VASHI, NAVI MUMBAI -400 703",GREATER MUMBAI,,,MAHARASHTRA
CSBK0000278,Catholic Syrian Bank,CSBK0000278,641047103,AVANASHI,"1ST FLOOR, PRIYADHARSHINI TOWERS, EAST CAR STREET, AVANASHI 641654, COIMBATORE DT., TAMIL NADU",COIMBOTORE,,,TAMIL NADU
CSBK0000280,Catholic Syrian Bank,CSBK0000280,680047001,THRISSUR SERVICE BR,"PO BOX NO 250, MAIN BRANCH PREMISES, ROUND SOUTH, THRISSUR - 680001",TRISSUR,,,KERALA
CSBK0000281,Catholic Syrian Bank,CSBK0000281,400047001,SERVICE BR. MUMBAI,"SERVICE BR. P.B.NO.925,53 EAST&WEST BLDGMUMBAI SAMACHAR MARG, OPP.MUMBAI STOCK EXCHANGE,FORT MUMBAI-400023, MAHARASHTRA",GREATER MUMBAI,,,MAHARASHTRA
CSBK0000282,Catholic Syrian Bank,CSBK0000282,411047002,RAMWADI,"26/4, MATCHWEL FACTORY ROAD, RAMWADI, PUNE - 411014",PUNE,,,MAHARASHTRA
CSBK0000283,Catholic Syrian Bank,CSBK0000283,110047003,ASHOK VIHAR DELHI,"OPP:DEEP CINEMA, ASHOK VIHAR, PHASE -I, DELHI - 110 052, NEW DELHI",NEW DELHI,,,DELHI
CSBK0000284,Catholic Syrian Bank,CSBK0000284,560047006,T.DASARAHALLI,"SRINIDHI TOWERS, NH-4, TUMKUR ROAD, T.DASARAHALLI, BANGALORE-560057",BANGALORE URBAN,,,KARNATAKA
CSBK0000285,Catholic Syrian Bank,CSBK0000285,NON-MICR,KARUMATHAMPATTY,"AYAR AMBROSE RURAL SELF EMPLOYMENT INSTITUTE BLDGS., AVANASHI RD., KARUMATHAMPATTY, COIMBATORE, T N- 641 659",COIMBOTORE,,,TAMIL NADU
CSBK0000286,Catholic Syrian Bank,CSBK0000286,400047007,KALYAN,"NISHANT II, VAIDYAWADI,RAMBAUG MAIN ROAD, KALYAN 421 301",GREATER MUMBAI,,,MAHARASHTRA
CSBK0000288,Catholic Syrian Bank,CSBK0000288,682047013,PONNURUNNI,"THAMMANAM RD,PONNURUNNI,KOCHI, P.O.VYTILLA,682019",ERNAKULAM,,,KERALA
CSBK0000289,Catholic Syrian Bank,CSBK0000289,682047002,IT DEPARTMENT,"D.J.M BUILDING, MARKET ROAD,COCHI,682011",ERNAKULAM,,,KERALA
CSBK0000290,Catholic Syrian Bank,CSBK0000290,NON-MICR,KALPAKANCHERY,"MAIN ROAD, KADUNGATHUKUNDU, KALPAKANCHERY - 676551",MALAPURAM,,,KERALA
CSBK0000291,Catholic Syrian Bank,CSBK0000291,400047008,VASAI,"C-001 ORNAMENT APARTMENT,  EVERSHINE CITY VASAI EADST",THANE,,,MAHARASHTRA
CSBK0000292,Catholic Syrian Bank,CSBK0000292,400047009,THANE,"OPP. ST JOHN THE BAPTIST H.S., JAMBLINAKA,THANE WEST 400 601",GREATER MUMBAI,,,MAHARASHTRA
CSBK0000293,Catholic Syrian Bank,CSBK0000293,NON-MICR,FTS CENTRE,"DJM BUILDING, MARKET ROAD, ERNAKULAM - 682011",ERNAKULAM,,,KERALA
CSBK0000294,Catholic Syrian Bank,CSBK0000294,160047002,CHANDIGARH,"SCO-114-115, SECTOR-34A, CHANDIGARH - 160 022, CHANDIGARH (U.T.)",CHANDIGARH,,,CHANDIGARH
CSBK0000295,Catholic Syrian Bank,CSBK0000295,141047002,LUDHIANA,"GREEN FIELD, NEAR SARABHA NAGAR CHOWK, LUDHIANA - 141 002, PUNJAB",LUDHIANA,,,PUNJAB
CSBK0000296,Catholic Syrian Bank,CSBK0000296,110047004,GREATER KAILASH,"M-17, MARKET, GREATER KAILASH II, NEW DELHI - 110 048, NEW DELHI",NEW DELHI,,,DELHI
CSBK0000297,Catholic Syrian Bank,CSBK0000297,110047005,NOIDA,"C-60, SECTOR-2, NOIDA - 201 301, GAUTHAM BUDH NAGAR(DT.), UTTAR PRADESH",GAUTAM BODDA NAGAR,,,UTTAR PRADESH
CSBK0000298,Catholic Syrian Bank,CSBK0000298,695047008,PATTOM,"ST.MARY'S HIGHER SECONDARY SCHOOL BUILDING, PATTOM, THIRUVANANTHAPURAM-695004, KERALA",TRIVANDRUM,,,KERALA
CSBK0000299,Catholic Syrian Bank,CSBK0000299,680047012,EAST FORT THRISSUR,"C.M.K. COMPLEX, PALAKKAD MAIN ROAD, EAST FORT, THRISSUR - 680005, KERALA",TRISSUR,,,KERALA
CSBK0000300,Catholic Syrian Bank,CSBK0000300,110047006,FARIDABAD,"A-2/B, NEELAM BATA ROAD, FARIDABAD - 121 001, HARYANA",FARIDABAD,,,HARYANA
CSBK0000301,Catholic Syrian Bank,CSBK0000301,400047012,VILE PARLE,"VILE PARLE BRANCH, NEAR BMC BAZAAR, OPP. PAWAN HOUSE, VILE PARLE (W), MUMBAI - 400 056",GREATER MUMBAI,,,MAHARASHTRA
CSBK0000302,Catholic Syrian Bank,CSBK0000302,NON-MICR,MULUND WEST(NAHUR),"SHOPNO.718 ST.PIUS X SCHOOL STPIUS SHOPPING CENTRE, MMM. RD, NAHUR,MULUND W ,MUMBAI-80",GREATER MUMBAI,,,MAHARASHTRA
CSBK0000303,Catholic Syrian Bank,CSBK0000303,400047010,ANDHERI WEST,"COSMOPOLITAN EDUCATION SOCIETY, VALIA COLLEGE OF COMMERCE AND ARTS, D.N NAGAR, LINK ROAD, ANDHERI WEST",GREATER MUMBAI,,,MAHARASHTRA
CSBK0000304,Catholic Syrian Bank,CSBK0000304,400047013,MAHIM WEST,VICTORIA HIGH SCHOOL SITLADEVI TEMPLE RD. MAHIM (W) MUMBAI - 400 016.,GREATER MUMBAI,,,MAHARASHTRA
CSBK0000305,Catholic Syrian Bank,CSBK0000305,600047011,PADI,"DOOR NO 32 , 1ST MAIN ROAD,OLYMPIC COLONY.PADI ,CHENNAI 600 050",CHENNAI,,,TAMIL NADU
CSBK0000306,Catholic Syrian Bank,CSBK0000306,641047002,R S PURAM COIMBATORE,"CSB ZONAL OFFICE PREMISES, 513, DB ROAD, R.S PURAM, COIMBATORE - 641002",COIMBOTORE,,,TAMIL NADU
CSBK0000308,Catholic Syrian Bank,CSBK0000308,686047003,KALATHIPADY,"NOYAPLAZA,KALATHIPADY,VADAVATHOOR PO,686010,KOTTAYAM DT,KERALA,INDIA",KOTTAYAM,,,KERALA
CSBK0000309,Catholic Syrian Bank,CSBK0000309,680047013,THALORE,"INFANT JESUS MONASTRY COMPLEX, P.O. THALORE, THRISSUR - 680306",TRISSUR,,,KERALA
CSBK0000310,Catholic Syrian Bank,CSBK0000310,NON-MICR,MALA,"ST. STANISLAUS FORANCE CHURCH BLDG., MALA 680732, THRISSUR DISTRICT",TRISSUR,,,KERALA
CSBK0000311,Catholic Syrian Bank,CSBK0000311,680047014,MANNUTHY,"ST. ANTONY'S CHURCH BUILDING, P.O. MANNUTHY - 680651, THRISSUR DISTRICT, KERALA",TRISSUR,,,KERALA
CSBK0000312,Catholic Syrian Bank,CSBK0000312,302047002,JAIPUR,"11, MOTILAL ATAL ROAD, JAIPUR - 302 001, RAJASTHAN",JAIPUR,,,RAJASTHAN
CSBK0000313,Catholic Syrian Bank,CSBK0000313,NON-MICR,THIRUMALA,"ROHINI BUILDING, THIRUMALA, TRIVANDRUM -6, KERALA",TRIVANDRUM,,,KERALA
CSBK0000314,Catholic Syrian Bank,CSBK0000314,NON-MICR,MARGAO,"RENATO BUILDING ,FR. MIRANDA ROAD , NEAR GARDEN,MARGAO - 403 601",SOUTH GOA,,,GOA
CSBK0000315,Catholic Syrian Bank,CSBK0000315,751047002,BHUBANESWAR,"NO.45, ASHOK NAGAR, JANPATH, BHUBANESWAR - 751 009, ORISSA",KHURDA,,,ORISSA
CSBK0000316,Catholic Syrian Bank,CSBK0000316,110047007,GURGAON,"SCO-4, GROUND FLOOR, SECTOR-14, NEAR PAYAL CINEMA, GURGAON-122 001, HARYANA",GURGAON,,,HARYANA
CSBK0000317,Catholic Syrian Bank,CSBK0000317,NON-MICR,MANJERI,"COURT ROAD, MANJERI - 676121, MALAPPURAM DISTRICT, KERALA",MALAPURAM,,,KERALA
CSBK0000318,Catholic Syrian Bank,CSBK0000318,144047002,JALANDHAR,"32, G T ROAD, AMARDEEP BUILDING, OPP:NARINDER CINEMA, JALANDHAR CITY - 144 001, PUNJAB",JALANDHAR,,,PUNJAB
CSBK0000320,Catholic Syrian Bank,CSBK0000320,600047012,ANNANAGAR CHENNAI,"B13,2ND MAIN ROAD, ANNA NAGAR EAST,CHENNAI 600 012",CHENNAI,,,TAMIL NADU
CSBK0000321,Catholic Syrian Bank,CSBK0000321,110047001,SERVICE BR DELHI,"G36, GROUND FLOOR, CONNAUGHT CIRCUS, NEW DELHI - 110001",NEW DELHI,,,DELHI
CSBK0000322,Catholic Syrian Bank,CSBK0000322,110047008,GAUTHAM NAGAR,"NO.216-A/5, NEAR FR.AGNEL SENIOR SECONDARY SCHOOL, GAUTAM NAGAR, NEW DELHI - 110 049, NEW DELHI",NEW DELHI,,,DELHI
CSBK0000323,Catholic Syrian Bank,CSBK0000323,680047016,KOTTEKAD,"ST. MARY'S ASSUMPTION CHURCH CHURCH SHOPPING COMPLEX, KOTTEKAD - 680013, THRISSUR DISTRICT",TRISSUR,,,KERALA
CSBK0000324,Catholic Syrian Bank,CSBK0000324,NON-MICR,PARAPPUR,"ST.JOHNS FORANE CHURCH PREMISES, PARAPPUR P.O., MUTHUVARA TRICHUR -680 552. KERALA.",TRISSUR,,,KERALA
CSBK0000325,Catholic Syrian Bank,CSBK0000325,NON-MICR,PARAPPUKKARA,"ST.JOHNS FORANE CHURCH PARAPPUKKARA - 680 310 TRICHUR DT., KERALA",TRISSUR,,,KERALA
CSBK0000326,Catholic Syrian Bank,CSBK0000326,680047017,POONKUNNAM,"PALISSERY  TOWER, NEAR  BSNL  TELEPHONE EXCHANGE, ACHUTHA MENON  ROAD, POONKUNNAM P.O., THRISSUR  680 002, KERALA",TRISSUR,,,KERALA
CSBK0000327,Catholic Syrian Bank,CSBK0000327,NON-MICR,VYLATHUR,"VIII/538 B, CHRISTY COMPLEX VYLATHUR, NHAMANANGAD P O TRICHUR - 679 563, KERALA",TRISSUR,,,KERALA
CSBK0000328,Catholic Syrian Bank,CSBK0000328,680047015,PARAVATTANI,"ST. ANTONY'S SHOPPING COMPLEX, PARAVATTANI - 680005, THRISSUR DISTRICT",TRISSUR,,,KERALA
CSBK0000329,Catholic Syrian Bank,CSBK0000329,695047007,NALANCHIRA,"SARVODAYA VIDYALAYA, NALANCHIRA, THIRUVANANTHAPURAM - 695015",TRIVANDRUM,,,KERALA
CSBK0000330,Catholic Syrian Bank,CSBK0000330,560047007,DHARMARAM,"DHARMARAM COLLEGE PO., CHRIST SCHOOL ROAD, BANGALORE - 560029",BANGALORE URBAN,,,KARNATAKA
CSBK0000331,Catholic Syrian Bank,CSBK0000331,400047014,BORIVLI,"ST.FRANCIS ITI, MOUNT POINSUR, BORIVILI WEST, MUMBAI - 400103",GREATER MUMBAI,,,MAHARASHTRA
CSBK0000332,Catholic Syrian Bank,CSBK0000332,NON-MICR,CHENGAROOR,"ST.GEORGE CATHOLIC CHURCH SHOPPING COMPX CHENGAROOR -689 594 PATHANAMTHITTA DT., KERALA",PATHANAMTHITTA,,,KERALA
CSBK0000333,Catholic Syrian Bank,CSBK0000333,400047015,BANDRA,"SOCIETY OF DIVINE WORD, 510, SVD HOUSE, OPP. NATIONAL COLLEGE, BANDRA WEST.",GREATER MUMBAI,,,MAHARASHTRA
CSBK0000334,Catholic Syrian Bank,CSBK0000334,695047013,"G H  JN., THIRUVANANTHAPURAM","GOVERNMENT HOSPITAL JUNCTION, DEEPA ARCADE, CONVENT ROAD, TRIVANDRUM - 695 001,KERALA",TRIVANDRUM,,,KERALA
CSBK0000335,Catholic Syrian Bank,CSBK0000335,NON-MICR,MALLAD,"NALAKATH  SHOPPING COMPLEX , MALLAD - 680 506 ,THRISSUR DISTRICT, KERALA",TRISSUR,,,KERALA
CSBK0000336,Catholic Syrian Bank,CSBK0000336,600047013,PERAVALLUR,"CATHOLIC SYRIAN BANK, PERAVALLUR, CHENNAI.",CHENNAI,,,TAMIL NADU
CSBK0000337,Catholic Syrian Bank,CSBK0000337,560047008,DAVIS ROAD BANGALORE,"ST.ALPHONSIAN HIGH SCHOOL, DAVIS ROAD, ST.THOMAS TOWN P.O., BANGALORE-560084",BANGALORE URBAN,,,KARNATAKA
CSBK0000338,Catholic Syrian Bank,CSBK0000338,NON-MICR,CHOONDAL,"ST.JOSEPH'S HOSPITAL BUILDING, CHOONDL P.O., TRICHUR. PIN - 680502, KERALA",TRISSUR,,,KERALA
CSBK0000339,Catholic Syrian Bank,CSBK0000339,400047016,ANDHERI EAST,"INSTITUTE OF INDIAN CULTURE, OPP.CANOSSA HIGH SCHOOL, MAHAKALI CAVES ROAD, ANDHERI EAST, MUMBAI 400093",GREATER MUMBAI,,,MAHARASHTRA
CSBK0000340,Catholic Syrian Bank,CSBK0000340,400047018,NERUL,"ST.THOMAS JACOBITE SYRIAN ORTHADOX CHURCH BLDG., NEAR ST.XAVIER'S SCHOOL, SECTOR-3, PLOT NO.10, NERUL, NAVI MUMBAI - 400 706",THANE,,,MAHARASHTRA
