ID,BANK,IFSC_CODE,MICR_CODE,BRANCH_NAME,ADDRESS,CONTACT,CITY,DISTRICT,STATE
CSBK0000341,Catholic Syrian Bank,CSBK0000341,NON-MICR,KUDASSANAD,"N.S.S. HIGH SCHOOL, KUDASSANAD- 689 512 ALLEPPEY DT., KERALA.",ALAPUZZHA,,,KERALA
CSBK0000342,Catholic Syrian Bank,CSBK0000342,NON-MICR,MALAPARAMBA,"PROVIDENCE WOMENS COLLEGE, CARMEL HILL, P.O MALAPARAMBA, KOZHIKODE - 673009",KOZHIKODE,,,KERALA
CSBK0000343,Catholic Syrian Bank,CSBK0000343,NON-MICR,KUZHIKATTUSSERY,"MARIA THRESA HOSPITAL KUZHIKATTUSSERY, TRICHUR PIN-680 696, KERALA",TRISSUR,,,KERALA
CSBK0000344,Catholic Syrian Bank,CSBK0000344,NON-MICR,THUMPAMON,"ST.MARYS ORTHODOX CATHEDRAL CHURCH THUMPAMON, VIA PANDALAM, PATHANAMTHITTA-689 502, KERALA",PATHANAMTHITTA,,,KERALA
CSBK0000345,Catholic Syrian Bank,CSBK0000345,NON-MICR,KARANCHIRA,"BISHOP ALAPATT MISSION HOSPITAL, KARANCHIRA, P.O.KATTOOR - 680 702. TRICHUR DT., KERALA.",TRISSUR,,,KERALA
CSBK0000346,Catholic Syrian Bank,CSBK0000346,400047020,DOMBIVLI,"ST.THERESE CONVENT SCHOOL, PANDIT DINDAYAL ROAD, DOMBIVILI WEST, MUMBAI - 421202",THANE,,,MAHARASHTRA
CSBK0000347,Catholic Syrian Bank,CSBK0000347,400047017,ULHAS NAGAR MUMBAI,"HOLY FAMILY CONVENT HS, LAL CHAKKI, ULHAS NAGAR, MUMBAI - 421004",THANE,,,MAHARASHTRA
CSBK0000348,Catholic Syrian Bank,CSBK0000348,682047022,TRIKKAKARA,"BHARAT MATHA COLLEGE, TRIKKAKARA, KOCHI - 682021",ERNAKULAM,,,KERALA
CSBK0000349,Catholic Syrian Bank,CSBK0000349,NON-MICR,MURINGOOR,"DIVINE RETREAT CENTRE, MURINGOOR, CHALAKUDY - 680 316 TRICHUR DT., KERALA.",TRISSUR,,,KERALA
CSBK0000350,Catholic Syrian Bank,CSBK0000350,NON-MICR,PULLUVAZHI,"ST.THOMAS CHURCH PREMISES, PULLUVAZHI, M.C ROAD, PERUMBAVOOR P.O., ERNAKULAM - 683 541, KERALA.",ERNAKULAM,,,KERALA
CSBK0000351,Catholic Syrian Bank,CSBK0000351,NON-MICR,PAYANKULAM,"SACRED HEART HOSPITAL, PAYANKULAM, THODUPUZHA-685 584 IDUKKI DT., KERALA.",IDUKKI,,,KERALA
CSBK0000352,Catholic Syrian Bank,CSBK0000352,NON-MICR,CHIRAKKADAVU,"DOOR NO. 260/A, VETTICATTU BUILDINGS, MANNAMPLAVU JUNCTION, CHIRAKKADAVU, KOTTAYAM-686 520, KERALA",KOTTAYAM,,,KERALA
CSBK0000353,Catholic Syrian Bank,CSBK0000353,NON-MICR,ATTINGAL,473/XII PRASAD HOTEL COMPLEX N H 47-NEAR KACHERY JUNCTION-ATTINGAL,TRIVANDRUM,,,KERALA
CSBK0000354,Catholic Syrian Bank,CSBK0000354,NON-MICR,PONNANI,"BALAKRISHNA BUILDING, OPP VIJAYAMATHA CONVENT MAIN ROAD, PONNANI 679577",MALAPURAM,,,KERALA
CSBK0000355,Catholic Syrian Bank,CSBK0000355,NON-MICR,EDAPPAL,C K TOWER NEAR BLOCK DEV.OFFICE PATTAMBI ROAD EDAPPAL 679 576 MALAPPURAM DT KERALA,MALAPURAM,,,KERALA
CSBK0000356,Catholic Syrian Bank,CSBK0000356,NON-MICR,HOSKOTE,K R EXTENSION NO.10321 HOSKOTE BANGALORE 562 114 KARNATAKA,BANGALORE RURAL,,,KARNATAKA
CSBK0000357,Catholic Syrian Bank,CSBK0000357,422047002,NASIK,"SHOP NO 9,10,11, CANADA CORNER, RUSHIRAJ AVENUE, SHARANPUR TIMBAK LINK ROAD, NASIK 422002, MAHARASHTRA",NASHIK,,,MAHARASHTRA
CSBK0000358,Catholic Syrian Bank,CSBK0000358,NON-MICR,HOSUR,"164, CITY SQUARE KRISHNAGIRI BYE PASS ROAD HOSUR 635 109, KRISHNAGIRI DT. T.NADU",KRISHNAGIRI,,,TAMIL NADU
CSBK0000359,Catholic Syrian Bank,CSBK0000359,NON-MICR,PHAGWARA,"MILAP TOWERS, G T ROAD PHAGWARA 144 401 PUNJAB",KAPURTHALA,,,PUNJAB
CSBK0000360,Catholic Syrian Bank,CSBK0000360,431047003,AURANGABAD,"OBEROI CHANMBERS, NEAR HOTEL AMAR PREET, JALNA ROAD, AURANGABAD, MAHARASHTRA - 431 001",AURANGABAD,,,MAHARASHTRA
CSBK0000361,Catholic Syrian Bank,CSBK0000361,530047002,VISAKHAPATNAM,"RATNASRI  NEAR DIAMOND PARK, SAVKARAMATTOM ROAD, DWARAKA NAGAR, VISAKHAPATNAM 530 016 ",VISHAKAPATNAM,,,ANDHRA PRADESH
CSBK0000362,Catholic Syrian Bank,CSBK0000362,NON-MICR,AVADI,"NO.65 NEHRU BAZAR OLD MARKET AVADI, CHENNAI",TIRUVALLUR,,,TAMIL NADU
CSBK0000363,Catholic Syrian Bank,CSBK0000363,NON-MICR,BOMMASANDRA,"KIADB BUILDING BOMMASANDRA INDUSTRIAL AREA COMPLEX HOSUR ROAD,BANGALORE 560 099",BANGALORE URBAN,,,KARNATAKA
CSBK0000364,Catholic Syrian Bank,CSBK0000364,700047004,SALT LAKE KOLKATTA,"NO.BF/25, SALT LAKE CITY SECTOR-1 KOLKATA 700 064",KOLKATA,,,WEST BENGAL
CSBK0000365,Catholic Syrian Bank,CSBK0000365,NON-MICR,KANAKAPURA,"KALYANI COMPLEX 2ND CROSS, B K ROAD KANAKAPURA 562 117  KARNATAKA",BANGALORE RURAL,,,KARNATAKA
CSBK0000366,Catholic Syrian Bank,CSBK0000366,560047011,DEVANAHALLI,"NEAR OLD BUS STAND, B B ROAD, DEVANAHALLI TOWN - 562110",BANGALORE RURAL,,,KARNATAKA
CSBK0000367,Catholic Syrian Bank,CSBK0000367,NON-MICR,KUMBAKONAM,"32, NAGESWARAN KOIL SANNATHI STREET KUMBAKONAM 612 001",THANJAVUR,,,TAMIL NADU
CSBK0000368,Catholic Syrian Bank,CSBK0000368,47000,CUDDALORE,"A.V.R.TOWERS,II FLOOR, NO.4,BHARATHI ROAD, CUDDALORE-607001",CUDDALORE,,,TAMIL NADU
CSBK0000369,Catholic Syrian Bank,CSBK0000369,NON-MICR,KUKATPALLY,5-222 VIVEKANANDA NAGAR COLONY KUKATPALLY HYDERABAD 500 072,RANGA REDDY,,,ANDHRA PRADESH
CSBK0000370,Catholic Syrian Bank,CSBK0000370,NON-MICR,SATARA,"VIJAY MILLENEIUM, SADAR BAZAR, NEAR ZILLA PARISHAD, VISAVA NAKA, SATARA, MAHARASHTRA 415001",SATARA,,,MAHARASHTRA
CSBK0000371,Catholic Syrian Bank,CSBK0000371,NON-MICR,JAMNAGAR,"SHIV' P N MARG OPP.DHANAVANTRY, UNIVERSITY OF AYURVEDA JAM NAGAR 361 008  GUJARAT",JAMNAGAR,,,GUJARAT
CSBK0000375,Catholic Syrian Bank,CSBK0000375,682047002,VOSTRO CELL,"D.J.M BUILDING, MARKET ROAD,KOCHI,682011",ERNAKULAM,,,KERALA
CSBK0000376,Catholic Syrian Bank,CSBK0000376,682047002,ALTERNATE CHANNELS,"D.J.M BUILDING, MARKET ROAD,COCHI,682011",ERNAKULAM,,,KERALA
CSBK0000377,Catholic Syrian Bank,CSBK0000377,629047102,MARTHANDAM,"1-14,A5.S VMALL,PAMMAM MARTHANDAM 629165,KANYAKUMARI DISTRICT,TAMILNADU",KANYAKUMARI,,,TAMIL NADU
CSBK0000378,Catholic Syrian Bank,CSBK0000378,NON-MICR,PERIYANAICKANPALAYAM,"23/A HARIPRIYA COMPLEX,LMW PIRIVU,PERIANAIKENPALAYAM,641020",PERIYANAICKANPALAYAM,PERIYANAICKANPALAYAM,COIMBATORE,TAMIL NADU
CSBK0000379,Catholic Syrian Bank,CSBK0000379,N A,PALLADAM,"365,TRICHY ROAD,NEAR DSP OFFICE,PALLADAM-641664",TIRUPUR,,,TAMILNADU
CSBK0000380,Catholic Syrian Bank,CSBK0000380,676047252,VALANCHERRY,"BUILDING NO III/747, MOOCHIKKAL , VALANCHERY 676552, MALAPPURAM DT",VALANCHERRY,VALANCHERRY,MALAPPURAM,KERALA
CSBK0000381,Catholic Syrian Bank,CSBK0000381,629047102,KOTTAKKAL,"SMART TRADE CITY,NEAR BUS STAND, KOTTAKKAL 676503",KOTTAKKAL,KOTTAKKAL,MALAPPURAM,KERALA
CSBK0000382,Catholic Syrian Bank,CSBK0000382,NON-MICR,NAMAKKAL,"782 A/1, RSR COMPLEX, SALEM MAIN ROAD, NAMAKKAL",NAMAKKAL,NAMAKKAL,NAMAKKAL,TAMIL NADU
CSBK0000383,Catholic Syrian Bank,CSBK0000383,110047009,GHAZIABAD,"R D C 21 & 22,GROUND FLOOR, ADVOCATE CHAMBERS,RAJ NAGAR, GHAZIABAD, UTTER PRADESH-201002",GHAZIABAD,GHAZIABAD,GHAZIABAD,UTTAR PRADESH
CSBK0000384,Catholic Syrian Bank,CSBK0000384,NON MICR,KOSI KALAN,"DOOR NO 4273,BALDEV GANJ,KOSI KALAN, MATHURA DT UTTAR PRADESH - 281 403",KOSI KALAN,KOSI KALAN,MATHURA,UTTAR PRADESH
CSBK0000385,Catholic Syrian Bank,CSBK0000385,NON MICR,KAMAN,"SURAJ BHAG COLONY, JURHARA ROAD, KAMAN  BHARTPUR-321022, RAJASTHAN",KAMAN,KAMAN,BHARTPUR,RAJASTHAN
CSBK0000386,Catholic Syrian Bank,CSBK0000386,282047002,AGRA,"SHREE TALKIES COMPOUND, NH-2,AGRA-282002",AGRA,,,UTTAR PRADESH
CSBK0000387,Catholic Syrian Bank,CSBK0000387,673047402,KONDOTTY,"GROUND FLOOR, TOWER 17,BYE PASS ROAD KONDOTTY         ",KONDOTTY,KUNDOTTY,MALAPPURAM,KERALA
CSBK0000388,Catholic Syrian Bank,CSBK0000388,400047021,VIRAR,"GROUND FLOOR, GOKUL PLAZA, OPP MULJIBHAI MEHTA INTERNATIONAL SCHOOL GOKUL TOWNSHIP,VIRAR WEST THANE 401303",VIRAR,VIRAR,THANE,MAHARASHTRA
CSBK0000389,Catholic Syrian Bank,CSBK0000389,400047022,BHAYANDER,"SHOP 7-8, ARIHANT DARSHAN,90 FT ROAD, NEAR FLYOVER BRIDGE, BHAYANDER WEST, THANE-401101",BHAYANDER,MIRA-BHAYANDAR,THANE,MAHARASHTRA
CSBK0000390,Catholic Syrian Bank,CSBK0000390,396047031,VAPI,"GROUND FLOOR,ORBIT,MAHALAKSHMI SOCIETY,VAPI-DAMAN ROAD,CHALA,VAPI,GUJARAT-396191",VAPI,VAPI,VALSAD,GUJARAT
CSBK0000391,Catholic Syrian Bank,CSBK0000391,NON MICR,SILVASA,"GROUND FLOOR, HOTEL PLAZA BUILDING, VAPI-SILVASSA MAIN ROAD,SILVASSA-396230",SILVASA,SILVASA,DADRA&NAGAR HAVELI,DADRA&NAGAR HAVELI
CSBK0000392,Catholic Syrian Bank,CSBK0000392,173047002,SOLAN,"GROUND FLOOR, DANG COMPLEX, NEAR D C OFFICE, RAJGARH ROAD, SOLAN, HIMACHAL PRADESH 173212.",SOLAN,SOLAN,SOLAN,HIMACHAL PRADESH
CSBK0000745,Catholic Syrian Bank,CSBK0000745,NONMICR,GANDHIPET,"GANDHIPET, TIRUPATHUR - 635 601, VELLORE DT., TAMILNADU",VELLORE,,,TAMIL NADU
CSBK0000396,Catholic Syrian Bank,CSBK0000396,BHAVNAGAR,BHAVNAGAR,"GROUND FLOOR, KRISHNA  DARSHAN, PARIMAL  CHOWK, WAGHAWADI  ROAD, BHAVNAGAR, GUJARAT-364001",PH:0278-2425911,BHAVNAGAR,BHAVNAGAR,GUJRAT
CSBK0000400,Catholic Syrian Bank,CSBK0000400,679047102,NILAMBUR,"2/640-G, JANATHAPADI, CNG ROAD , NILAMBUR -679329.","JOGGY C J  MANAGER, MOB: 9846222778,   TELEPHONE :04931-220606  EMAIL: NILAMBUR@CSB.CO.IN  ",NILAMBUR,MALAPPURAM,KERALA
CSBK0000397,Catholic Syrian Bank,CSBK0000397,396047112,AMLI,"GROUND FLOOR, RIDDHI APTS., NEAR HANUMAN MANDIR,  66 KVA ROAD, AMILI, SILVASSA 396230, (U T OF D & NH).","THOMAS JOSEPH ; MANAGER MOBLE: 09726058708, EMAILID: AMLI@CSB.CO.IN ",AMLI,DADRA&NAGAR HAVELI,DADRA&NAGAR HAVELI
CSBK0000403,Catholic Syrian Bank,CSBK0000403,NON MICR,UDAIPUR,"PLOT NO. 158, ASHWANI BAZAR, NEAR DELHI GATE, UDAIPUR 313001","MR AJAY OBEROI,MANAGER, TEL.: 0394-2411689,  MOBILE: 8233718649, MR AASHISH BORA,, TEL.: 0394-2411689, E-MAIL: UDAIPUR@CSB.CO.IN, MOBILE: 9461438578",UDAIPUR,UDAIPUR,RAJASTHAN
CSBK0000404,Catholic Syrian Bank,CSBK0000404,NON MICR,UJJAIN,"GROUND FLOOR, 37, AMAR SINGH MARG, FREEGANJ, UJJAIN 456010, MADHYA PRADESH","TOMY P A ; MANAGER ; PH: 0734 6052404 , 0734 2519293, 07828468506; EMAILID: UJJAIN@CSB.CO.IN,AMITH PANDE PROB ASST MANAGER  09691689083, EMAILID: UJJAIN@CSB.CO.IN",UJJAIN,UJJAIN,MADHYA PRADESH
CSBK0000395,Catholic Syrian Bank,CSBK0000395,416047002,KOLHAPUR,"514/1 /D ,  NEAR CBS ,STATION ROAD, KOLHAPUR 416 001","PAUL EMMATTY,SENIOR MANAGER -2316067929,KOLHAPUR@CSB.CO.IN",KOLHAPUR,KOLHAPUR,MAHARASHTRA
CSBK0000399,Catholic Syrian Bank,CSBK0000399,NON-MICR,AMRAVATI,"GROUND FLOOR, GULSHAN PLAZA, BADNERA ROAD, RAJAPET, AMARAVATI-444601","MATHEW  T S ,BRANCH MANAGER , PHONE 0721 6005115,PINTO PAUL,ASST.MANAGER, MOB-08879437666 , AMRAVATI@CSB.CO.IN",AMRAVATI,AMRAVATI,MAHARASHTRA
CSBK0000401,Catholic Syrian Bank,CSBK0000401,NON-MICR,KUTTIPURAM,"DEIRA TOWER, NH 17 JUNCTION,  KUTTIPPURAM-679571","DIAS DAVID, SENIOR MANAGER - PHONE  0494 2606111,KUTTIPPURAM@CSB.CO.IN",KUTTIPURAM,MALAPPURAM,KERALA
CSBK0000398,Catholic Syrian Bank,CSBK0000398,NON MICR,SRIPERUMBUDUR,"29 & 29A, THERADI STREET,SRIPERUMBUDUR, KANCHEEPURAM DISTRICT-602105","MR KISHORE KUMAR  O S MARAPPAN , BRANCH MANAGER -'EMAIL : SRIPERUMBUDUR@CSB.CO.IN,PH: 044-27162511",SRIPERUMBUDUR,KANCHEEPURAM,TAMIL NADU
CSBK0000402,Catholic Syrian Bank,CSBK0000402,NON MICR,BHIWADI,"SPL-1-L,PHASE 1,INDUSTRIAL AREA,BHIWADI,DISTT-ALWAR,RAJASTHAN-301019","MR MANISH KUMAR JHA,MOBILE-9310629886;'MR R D SHARMA,MOBILE-09540213010, PH NO : 0129 6450231",BHIWADI,ALWAR,RAJASTHAN
CSBK0000407,Catholic Syrian Bank,CSBK0000407,NON MICR,WALAJAPET,"GROUND FLOOR, PLOT NO-C-6, C-12 PART , BLOCK NO-1, WARD NO-2, T.N.H.B, WALAJAPET-632513, VELLORE DISTRICT, TAMIL NADU","RAGHUNATH R , BRANCH MANAGER 9442849423, PHONE NO: 9943096170,EMAILID: WALAJAPET@CSB.CO.IN",WALAJAPET,VELLORE,TAMIL NADU
CSBK0000408,Catholic Syrian Bank,CSBK0000408,444047002,AKOLA,"PLOT NO 31/4B,HOLY CROSS CONVENT ROAD,OPP:KHANDELWAL MARUTI SHOW ROOM,AKOLA-444001, MAHARASHTRA","RAJESH TR 08806921860  EMAIL AKOLA@CSB.CO.IN,RAJESH TR 08806921860  EMAIL AKOLA@CSB.CO.IN",AKOLA,AHMADNAGAR,MAHARASHTRA